422201801,00: 07 | 29/06/2021,Mỹ Anh,5.0,Mình mua chai màu vàng thì khong biết so với chai hồng có hơn khong nhưng first impression thì nó thơm .-. Khong hắc đâu một lúc sau 4tieng mình vẫn ngửi thấy mùi thơm nhẹ . Xài về lâu dài ko biết có tốt khong nhưng trc mắt là mượt tóc quá .-. Như kiểu có một lớp màng bọc tóc ko bị xù ý túm lại là gút
422201801,14: 12 | 13/05/2021,Lê Thảo,5.0,"Vừa thơm vừa mượt tóc nữa, mềm mịn hẳn luôn, 5 sao"
422201801,16: 41 | 15/04/2021,PHAM THANH NGAN,5.0,"Kiểu tìm được chân ái cho mái tóc xơ khô của mình huhu giá mà biết đến sản phẩm sớm hơn. Mình đã từng dùng qua rất nhiều loại dưỡng ủ, nhưng đâu lại vào đấy, gãy rụng và xơ khô, từ lúc xài double rich, xịt 1 lần là mê mệt vì thơm và mềm tóc cực kì, mềm kiểu thấm vào tóc chứ ko ảo. "
422202341,19: 25 | 12/12/2023,Trần Thị Hà Phương,4.0,"Xài cũng mượt mà mùi hơi khó chịu, hôi mùi thuốc duỗi tóc."
422202341,19: 23 | 12/12/2023,Trần Thị Hà Phương,5.0,"Màu vàng và nâu thơm, xài mượt tóc, mà phải xài hàng ngày, ngưng là tóc bị khô lại."
422202341,14: 39 | 15/04/2023,Khánh Ly,5.0,Thơm lắm nha
422202341,09: 34 | 17/03/2023,Trần Lũy,5.0,"Sức lên mượt tóc ghê á, thơm nữa."
422202341,16: 21 | 10/02/2023,Phúc Diễm,5.0,"xài rất ok. thơm nữa, ko dính bết gì hết, mà sao giá càng tăng trước mình mua có 139k thùi"
422202341,20: 57 | 02/02/2023,Xuyến Moon,4.0,mùi thơm nha dưỡng chất nhìu lắm tóc tui dài nên sử dụng sáng tối một viên là dc hai lần.còn bà nào tóc ít hoặc ngắn thì 2.5/3l một viên củng dc
422202341,20: 54 | 04/01/2023,Oanh Kiều,5.0,"sp dùng tốt ạ. k bết dính thoa vào thấm nhanh như chưa dùng z.định mua 1 hủ mà giá cao quá, với lại 1v sd 1.lần k hết nên mình chuyển qua loại khác"
422202341,01: 11 | 03/01/2023,Vũ Thị Thủy Trúc,5.0,"mình xài hủ màu hồng, tóc nhuộm và uốn nên rất khô sơ, xài thấy có sự cải thiện."
422202341,16: 22 | 28/12/2022,Nguyễn Thúy Vy,5.0,"M mua màu vàng, mới xài thử lần đầu mà thấy mướt lắm, làm mềm tóc, đặc biệt k bị rít tóc, xài lần 1 viên rất tiện, lần sau sẽ mua nguyên hủ lớn xài cho lâu"
422202341,16: 59 | 05/08/2022,Thu Trang,5.0,"dưỡng tóc mượt lắm, mình mới dùng 2 viên, còn 48 viên muốn sale lại 100k ai cần liên hệ zalo 0326607766"
422207738,20: 37 | 30/05/2024,Nguyễn thục linh,5.0,M dùng tóc bết dầu như kiểu dùng dầu dừa chứ k phải xịt bưởi. M thắc mắc xịt bưởi sao bọt trong chai nhiều lắm.
422207738,17: 58 | 23/05/2024,Ngọc,4.0,"Xịt bưởi thơm, giảm rụng và mọc tóc con . Nhưng hi vọng hãng đầu tư vòi xịt xịn xíu được không ạ. Lúc sử dụng tinh dầu tràng lung tung ra rât nhiều dưới vồi xịt. :))"
422207738,14: 13 | 30/03/2024,Huyen Pham,5.0,"Mình mua chai lớn vòi xịt oke, xài 2,3 tuần thấy tóc có mọc và đỡ rụng thật á mn. Nhưng hơi bết chân tóc xíu nha, nên phải gội ngày 1 lần or xịt ít thì 2 ngày gội. Nch mình thấy hiệu quả hơn Cocoon"
422207738,08: 46 | 07/03/2024,Võ nguyên ngoc đoan,5.0,"mình mua lần 2 r nha, tuy tốn thêm khoản mua chai xịt chiết ra nhưng chất lượng ok nên tha thứ đc nè, mọc tóc nhiều, nhanh, mượt tóc, k bếch dính ☺☺☺. hẹn chai thứ 3 ạ"
422207738,10: 15 | 29/12/2023,Sinh Đào,5.0,chất lượng rất ok nhé
422207738,16: 17 | 07/12/2023,Lương Xim,5.0,Chất lượng rất tốt
422207738,16: 17 | 07/12/2023,CHỊ NA,5.0,Ok lắm
422207738,20: 27 | 19/10/2023,c lan anh,4.0,"sp cx ổn, kích thích mọc tóc nên h cái đầu tui đỡ trống rồi, còn ngăn rụng tóc thì chưa thấy rõ lắm. mà nếu mua thì mua cái dạng chai nhỏ ấy, mua chai lớn cái vòi xịt sida lắm, nhiễu nước tùm lum, tui mới gắn lại cái  kim xịt do nó bị bung ra. à mà ko bik sao từ lúc xịt tui hay bị nhức đầu chỗ xịt ấy, ko bik có phải do kích ứng hay là do sp nó thế vậy?"
422207738,16: 42 | 06/10/2023,vân vân,5.0,"chất lượng thì giảm rụng, nhưng chán cái vòi xịt mới quá, xịt thì nhiễu nước chứ ko xịt  bung ra tia nhỏ, dù vặn kỹ thì mỗi lần lắc lên thì vòi xịt cũng nhiễu nước chảy tùm lum.vòi xịt cũ xài ngon hơn"
422207738,14: 13 | 11/09/2023,Bảo Ngọc,5.0,Giá rẻ. Chất lượng tốt. Mãi iu
422207738,20: 23 | 17/10/2022,Thanh Trúc,5.0,"Serum thơm nhẹ, xịt lên tóc thoang thoảng mùi bưởi. Có giảm rụng tóc và mọc tóc con. Giá thành tốt."
422207738,13: 36 | 29/09/2022,nguyễn thị nhàn,5.0,"Dầu xịt lên tóc thơm, mềm tóc không rít. thật sự đáng mua. Giá còn rẻ nữa"
422207738,21: 40 | 22/09/2022,Nguyễn Như,5.0,"hiệu quả, ko bết tóc. mùi dễ chịu dễ xịt! nên mua để tóc mọc nha mọi ng"
422207738,19: 19 | 22/09/2022,Nguyen Thi Thu Thao,5.0,"Mình xài loại này rất thích, giảm rụng tóc hẳn, tuy nhiên đầu xịt hay tắc và rỉ nước, chắc nhiều người cmt quá nên nhà sx thiết kế vòi xịt mới nhìn rất ok."
422207738,20: 47 | 15/09/2022,Dung Tú,3.0,"mới xịt thì thơm mùi bưởi ngọt lắm, nhưng để chút là bay mất, mùi đọng lại khó chịu. vòi xịt cũng hay nghẹt."
422207738,22: 50 | 01/09/2022,xuân hiền,3.0,"Xài lần đầu mình cảm thấy khó chịu cái vòi quá tệ, serum chảy ra ngoài dù mình không xịt nha."
422207738,17: 24 | 18/08/2022,Trần Đỗ Thanh Thảo,5.0,"thơm mùi bưởi lắm, mới dùng nên chưa biết có công dụng gì không, đc tặng thêm 1 đầu xịt nữa nên okela"
422207738,18: 07 | 05/08/2022,Trần Thị Thu Hiền,4.0,"Mình xài rất oki, kích mọc tóc sau 3 tuần là thiệt nha, mình xài không bết tóc "
422207738,21: 53 | 06/05/2022,Thanh Thúy,2.0,Thơm hương bưởi dễ chịu . Thấy mọi người đánh giá vòi khó xịt cũng mua thử ai dè khó thiệt . Xịt chảy ra tay tùm lum luôn không xịt vào chân tóc được bao nhiêu . Chưa biết hiệu quả hay không mà vòi xịt vậy thì không sử dụng được . Xịt lúc tóc còn ẩm mà cảm giác hơi bết .
422207738,08: 40 | 04/05/2022,Nguyễn Yến,5.0,mua hàng bên 
422207738,21: 25 | 25/01/2021,Nguyễn Hậu,4.0,vòi khó xịt
422207738,23: 30 | 21/12/2020,Lê Đỗ Hạnh Nguyên,5.0,"Mình mua combo 3 chai đợt sale còn 99k, dùng đến nay thì cả mình và ny đều mọc tóc con và tóc cũng khỏe hơn dù mình chỉ dùng sau khi gội xong. Mùi rất thơm nha, lưu hương ổn. Mong shop nhập loại 250ml về để mình đỡ mua lại nhiều lần hihi."
422207738,05: 20 | 06/09/2020,XUÂN,4.0,"Serum dùng ok . Mùi thấy thơm dễ chịu . Giá rẻ . Điểm trừ là hơi bết, vòi xịt dễ hư tắt nghẽn"
422207738,12: 19 | 01/09/2020,Hà Mỹ Duyên,5.0,"mình thì k thích mấy cái chai có mùi hương liệu quá nhiều, nhưng mà thực sự chai này mùi bưởi khá thơm sài cũng ok"
422207738,01: 41 | 13/02/2020,đoàn thị trúc,5.0,"sản phẩm tốt nhưng làm như sản phẩm Việt Nam là phải thiết kế bao bì xấu như vậy hay sao ý
"
422207738,10: 01 | 29/06/2019,Anh Thu Nguyen Le,5.0,"sản phẩm đóng gói cẩn thận, mùi chai tinh dầu rất thơm nha, 
sản phẩm này nuôi dưỡng, phục hồi và kích thích mọc tóc cho bạn nào muốn "
422211415,23: 17 | 08/07/2024,Ha nn,5.0,"mng ơi , mình có xài chai này rồi , mùi hương của nó thơm quá , ai bíc nước hoa nào mùi giống vậy mng chỉ mình với ạ , mình đội ơn rất nhiều ,chỗ này k cmt qua lại dc , có gì mng nhắn ig cukieuismeee giúp mình nha , mình cảm ơn ạ"
422211415,00: 52 | 09/04/2024,C. Vy,5.0,"Em sd còn nửa chai muốn pass. Em pass 70K thôi do muốn đổi loại mới xài, HCM - 083 4546166"
422211415,11: 39 | 27/11/2023,Yến Nhi,5.0,"Rất hài lòng, mềm mượt lắm"
422211415,13: 46 | 08/11/2023,Ngọc Anh,5.0,"Mình có thấy đánh giá của mọi người khi sử dụng em này bị bết tóc. Nên mình cũng có chút e ngại khi mua. Sau khi sử dụng mình thấy rất ổn nha. Trộm vía tóc rất mượt không bị khô. 
Khi gội đầu xong mình quấn khăn thấm bớt nước tầm 15-20p sau đó mình chia đôi tóc và mỗi bên mình chỉ sử dụng nửa pump. Và nửa pump dành cho toàn bộ đuôi tóc. Và bắt đầu sấy tóc. Đúng khi mới sử dụng tóc sẽ hơi bết một chút nhưng không quá đáng kể nhìn như tóc dơ. Tuy nhiên, qua ngày hôm sau thì tóc mềm đẹp lắm nha."
422211415,21: 56 | 03/10/2023,TẠ MỸ,5.0,"Thấy mọi người nói bết mà tóc mình thuộc dạng da đầu dầu, cách 1 ngày là phải gội nhưng xài vẫn ko bết nha, nếu ai bị tóc dầu thì khi ướt thoa lên phải sấy 1 lúc, hoặc để tóc khô bông lên hẳn rồi hãy bôi lên."
422211415,02: 33 | 24/08/2023,Duy Quang,5.0,Chai nhìn sang lắm
422211415,21: 16 | 21/08/2023,Nguyễn Trinh,5.0,"Dùng đc hơn nữa lọ r, dùng ok thơm giá hợp lí, khi tóc còn ẩm xoa lên cải thiện khô hẳn dùng lâu thì tóc sẽ phục hồi đỡ hư hại nhe nên mua ạ"
422211415,18: 03 | 12/08/2023,Trần Thị Thanh Minh,5.0,"Dùng xong nhìn như tóc bết, nhưng mà tóc mình khô xơ, xù nên mình thấy ổn :))) với cả cũng chỉ bết bết đến hết buổi sáng hôm sau chứ k lâu đâu"
422211415,19: 20 | 11/06/2023,Diệu Huyền,4.0,loại mới này phải sài lúc tóc ướt 1 bump mỗi bên rồi sấy chứ sài lúc tóc khô là siêu bết. do tóc mình nhuộm nên sài em này cx ok
422211415,16: 40 | 29/03/2023,Nguyễn Nhiên,2.0,"Hãng ơi, trả lại cho mình mẫu cũ đi, mẫu mới này bết tóc quá huhu. Mẫu cũ dưỡng tốt bao nhiêu thì mẫu mới này dưỡng tệ hơn nhiều, mình bôi vào đuôi tóc mà nó nặng với bết, làm tóc nặng xuống, xẹp, ko bồng bềnh nổi."
422211415,22: 21 | 24/02/2022,Hoàng Thị Lý,5.0,"Dầu thơm nhẹ, mình dùng đc 3 4 tháng rồi, thấy tóc bóng mượt lên hẳn, ko hề bết dính nha , mình thấy hợp với bạn nào tóc khô xơ, hư tổn nhẹ, nếu nặng thì hiệu quả sẽ hơi lâu nha"
422211415,09: 49 | 23/02/2022,Quyet Le,5.0,"Mùi thơm nhẹ nhàng, tóc mềm mượt, không bị bết"
422211415,13: 48 | 10/02/2022,Yến Đinh,5.0,"Tuyệt dời. Làm tóc mềm mượt, không bết mà mùi thơm nhẹ nhàng nữa. Nên mua nhé"
422211415,21: 03 | 25/01/2022,Kim Thắm,4.0,Cho e hỏi Tóc em đã nhuộm Thì mình dùng Loại này có giữ màu tóc được không ạ
422211415,22: 24 | 08/12/2021,Như Như,5.0,"sài lượng vừa đủ sẽ không gây bết tóc mùi thơm lạ lắm mọi người haha mình mua giá tầm 148 thì phải , nên mua nhé"
422211415,14: 03 | 23/11/2021,Trương mẫn nghi,5.0,"Bữa nhuộm tóc xong bị khô, liền lên khiên em này về. Phải nói rất ưng luôn. Làm tóc mềm mượt. Thích cái nữa là nó ko bị bết tóc. Chấm 10 điểm"
422211415,22: 34 | 04/10/2021,Hạnh Dương Kim,5.0,"Chai thủy tinh cầm nặng tay. Dầu dưỡng chất đặc nên thoa vừa đủ  , hương thơm bám lâu trên tóc."
422211415,16: 13 | 02/10/2021,PHẠM QUỲNH Anh,5.0,sức lên tóc mềm và rất mượt. cảm ơn
422211415,18: 44 | 20/08/2021,nguyễn ngọc vy,5.0,mùi rất thơm và rất mượt . mua hàng được đóng gói cẩn thận . hàng đúng y như hình
422211415,15: 30 | 05/06/2021,Kiều Trinh,5.0,"mình trước h hay dùng xịt dưỡng tóc vì sợ dùng tinh dầu dễ bết,đây là chai tinh dầu đầu tiên mình dùng ưng lắm luôn ạ tóc mềm lắm mà k bị bết ,mọi ng nên mua nha"
422211415,09: 02 | 26/05/2021,Thân Thị Thúy Nhi,5.0,"xài 2 chai rùi, tóc mượt hẳn, gội xong lúc tóc còn ướt bôi lên tóc mềm dễ chải với ko bị rụng, mua sale 119k ưng ghê"
422211415,18: 56 | 05/05/2021,Heo Con Pun,5.0,"dưỡng tóc mềm mượt, đỡ sơ rối"
422211415,15: 53 | 21/02/2021,Võ Bùi Thanh Thúy,5.0, 
422211415,15: 29 | 30/01/2021,Lê Thị Bích Tuyền,5.0, 
422211415,08: 32 | 29/01/2021,Lê Thị Nhi,5.0,"mềm mượt ,tơi tóc,mùi thơm nhẹ 
khá ưng"
422211415,08: 15 | 14/01/2021,Trần Thị Thủy Tiên,5.0, 
422211415,10: 47 | 14/12/2020,CHỊ KIM THƯ,5.0,cực tốt luôn nhé. mềm mượt tơi tóc. ko bết dính. 
422211415,21: 02 | 11/12/2020,Thu Huynh,5.0," Chỉ cần vài giọt là có mái tóc như ý luôn, mừng lắm phải chi biết sớm chai dầu này thì đỡ khổ vì mái tóc rối rồi. "
422211415,14: 52 | 22/09/2020,ngochiepnguyen,5.0,Bôi vào để qua đêm tóc mềm hơn khoảng 50%. ok.
422211415,17: 51 | 07/07/2020,Trịnh Lê khánh minh,5.0,Good !
422211415,17: 54 | 11/04/2020,LUU THI HONG VAN,5.0,"Sản phẩm tốt, tóc bóng mượt, và tơi, không bị bết"
422202625,20: 37 | 30/05/2024,Nguyễn thục linh,5.0,M dùng tóc bết dầu như kiểu dùng dầu dừa chứ k phải xịt bưởi. M thắc mắc xịt bưởi sao bọt trong chai nhiều lắm.
422202625,17: 58 | 23/05/2024,Ngọc,4.0,"Xịt bưởi thơm, giảm rụng và mọc tóc con . Nhưng hi vọng hãng đầu tư vòi xịt xịn xíu được không ạ. Lúc sử dụng tinh dầu tràng lung tung ra rât nhiều dưới vồi xịt. :))"
422202625,14: 13 | 30/03/2024,Huyen Pham,5.0,"Mình mua chai lớn vòi xịt oke, xài 2,3 tuần thấy tóc có mọc và đỡ rụng thật á mn. Nhưng hơi bết chân tóc xíu nha, nên phải gội ngày 1 lần or xịt ít thì 2 ngày gội. Nch mình thấy hiệu quả hơn Cocoon"
422202625,08: 46 | 07/03/2024,Võ nguyên ngoc đoan,5.0,"mình mua lần 2 r nha, tuy tốn thêm khoản mua chai xịt chiết ra nhưng chất lượng ok nên tha thứ đc nè, mọc tóc nhiều, nhanh, mượt tóc, k bếch dính ☺☺☺. hẹn chai thứ 3 ạ"
422202625,10: 15 | 29/12/2023,Sinh Đào,5.0,chất lượng rất ok nhé
422202625,16: 17 | 07/12/2023,Lương Xim,5.0,Chất lượng rất tốt
422202625,16: 17 | 07/12/2023,CHỊ NA,5.0,Ok lắm
422202625,20: 27 | 19/10/2023,c lan anh,4.0,"sp cx ổn, kích thích mọc tóc nên h cái đầu tui đỡ trống rồi, còn ngăn rụng tóc thì chưa thấy rõ lắm. mà nếu mua thì mua cái dạng chai nhỏ ấy, mua chai lớn cái vòi xịt sida lắm, nhiễu nước tùm lum, tui mới gắn lại cái  kim xịt do nó bị bung ra. à mà ko bik sao từ lúc xịt tui hay bị nhức đầu chỗ xịt ấy, ko bik có phải do kích ứng hay là do sp nó thế vậy?"
422202625,16: 42 | 06/10/2023,vân vân,5.0,"chất lượng thì giảm rụng, nhưng chán cái vòi xịt mới quá, xịt thì nhiễu nước chứ ko xịt  bung ra tia nhỏ, dù vặn kỹ thì mỗi lần lắc lên thì vòi xịt cũng nhiễu nước chảy tùm lum.vòi xịt cũ xài ngon hơn"
422202625,14: 13 | 11/09/2023,Bảo Ngọc,5.0,Giá rẻ. Chất lượng tốt. Mãi iu
422202625,20: 23 | 17/10/2022,Thanh Trúc,5.0,"Serum thơm nhẹ, xịt lên tóc thoang thoảng mùi bưởi. Có giảm rụng tóc và mọc tóc con. Giá thành tốt."
422202625,13: 36 | 29/09/2022,nguyễn thị nhàn,5.0,"Dầu xịt lên tóc thơm, mềm tóc không rít. thật sự đáng mua. Giá còn rẻ nữa"
422202625,21: 40 | 22/09/2022,Nguyễn Như,5.0,"hiệu quả, ko bết tóc. mùi dễ chịu dễ xịt! nên mua để tóc mọc nha mọi ng"
422202625,19: 19 | 22/09/2022,Nguyen Thi Thu Thao,5.0,"Mình xài loại này rất thích, giảm rụng tóc hẳn, tuy nhiên đầu xịt hay tắc và rỉ nước, chắc nhiều người cmt quá nên nhà sx thiết kế vòi xịt mới nhìn rất ok."
422202625,20: 47 | 15/09/2022,Dung Tú,3.0,"mới xịt thì thơm mùi bưởi ngọt lắm, nhưng để chút là bay mất, mùi đọng lại khó chịu. vòi xịt cũng hay nghẹt."
422202625,22: 50 | 01/09/2022,xuân hiền,3.0,"Xài lần đầu mình cảm thấy khó chịu cái vòi quá tệ, serum chảy ra ngoài dù mình không xịt nha."
422202625,17: 24 | 18/08/2022,Trần Đỗ Thanh Thảo,5.0,"thơm mùi bưởi lắm, mới dùng nên chưa biết có công dụng gì không, đc tặng thêm 1 đầu xịt nữa nên okela"
422202625,18: 07 | 05/08/2022,Trần Thị Thu Hiền,4.0,"Mình xài rất oki, kích mọc tóc sau 3 tuần là thiệt nha, mình xài không bết tóc "
422202625,21: 53 | 06/05/2022,Thanh Thúy,2.0,Thơm hương bưởi dễ chịu . Thấy mọi người đánh giá vòi khó xịt cũng mua thử ai dè khó thiệt . Xịt chảy ra tay tùm lum luôn không xịt vào chân tóc được bao nhiêu . Chưa biết hiệu quả hay không mà vòi xịt vậy thì không sử dụng được . Xịt lúc tóc còn ẩm mà cảm giác hơi bết .
422202625,08: 40 | 04/05/2022,Nguyễn Yến,5.0,mua hàng bên 
422202625,21: 25 | 25/01/2021,Nguyễn Hậu,4.0,vòi khó xịt
422202625,23: 30 | 21/12/2020,Lê Đỗ Hạnh Nguyên,5.0,"Mình mua combo 3 chai đợt sale còn 99k, dùng đến nay thì cả mình và ny đều mọc tóc con và tóc cũng khỏe hơn dù mình chỉ dùng sau khi gội xong. Mùi rất thơm nha, lưu hương ổn. Mong shop nhập loại 250ml về để mình đỡ mua lại nhiều lần hihi."
422202625,05: 20 | 06/09/2020,XUÂN,4.0,"Serum dùng ok . Mùi thấy thơm dễ chịu . Giá rẻ . Điểm trừ là hơi bết, vòi xịt dễ hư tắt nghẽn"
422202625,12: 19 | 01/09/2020,Hà Mỹ Duyên,5.0,"mình thì k thích mấy cái chai có mùi hương liệu quá nhiều, nhưng mà thực sự chai này mùi bưởi khá thơm sài cũng ok"
422202625,01: 41 | 13/02/2020,đoàn thị trúc,5.0,"sản phẩm tốt nhưng làm như sản phẩm Việt Nam là phải thiết kế bao bì xấu như vậy hay sao ý
"
422202625,10: 01 | 29/06/2019,Anh Thu Nguyen Le,5.0,"sản phẩm đóng gói cẩn thận, mùi chai tinh dầu rất thơm nha, 
sản phẩm này nuôi dưỡng, phục hồi và kích thích mọc tóc cho bạn nào muốn "
422202342,19: 25 | 12/12/2023,Trần Thị Hà Phương,4.0,"Xài cũng mượt mà mùi hơi khó chịu, hôi mùi thuốc duỗi tóc."
422202342,19: 23 | 12/12/2023,Trần Thị Hà Phương,5.0,"Màu vàng và nâu thơm, xài mượt tóc, mà phải xài hàng ngày, ngưng là tóc bị khô lại."
422202342,14: 39 | 15/04/2023,Khánh Ly,5.0,Thơm lắm nha
422202342,09: 34 | 17/03/2023,Trần Lũy,5.0,"Sức lên mượt tóc ghê á, thơm nữa."
422202342,16: 21 | 10/02/2023,Phúc Diễm,5.0,"xài rất ok. thơm nữa, ko dính bết gì hết, mà sao giá càng tăng trước mình mua có 139k thùi"
422202342,20: 57 | 02/02/2023,Xuyến Moon,4.0,mùi thơm nha dưỡng chất nhìu lắm tóc tui dài nên sử dụng sáng tối một viên là dc hai lần.còn bà nào tóc ít hoặc ngắn thì 2.5/3l một viên củng dc
422202342,20: 54 | 04/01/2023,Oanh Kiều,5.0,"sp dùng tốt ạ. k bết dính thoa vào thấm nhanh như chưa dùng z.định mua 1 hủ mà giá cao quá, với lại 1v sd 1.lần k hết nên mình chuyển qua loại khác"
422202342,01: 11 | 03/01/2023,Vũ Thị Thủy Trúc,5.0,"mình xài hủ màu hồng, tóc nhuộm và uốn nên rất khô sơ, xài thấy có sự cải thiện."
422202342,16: 22 | 28/12/2022,Nguyễn Thúy Vy,5.0,"M mua màu vàng, mới xài thử lần đầu mà thấy mướt lắm, làm mềm tóc, đặc biệt k bị rít tóc, xài lần 1 viên rất tiện, lần sau sẽ mua nguyên hủ lớn xài cho lâu"
422202342,16: 59 | 05/08/2022,Thu Trang,5.0,"dưỡng tóc mượt lắm, mình mới dùng 2 viên, còn 48 viên muốn sale lại 100k ai cần liên hệ zalo 0326607766"
308100016,19: 43 | 15/11/2023,C LINH,5.0,Lành tính mùi hương thảo dược dạng sệt xài tiết kiệm và không bị bết tóc
308100016,08: 26 | 06/11/2023,Linh Vo,5.0,"Theo cảm nhận của mình, mình dùng chai này không bị bếch tóc, ổn áp. Mình mua sale 144 cành (tinh dầu bưởi+ tình chất dưỡng tóc sachi)"
308100016,23: 58 | 28/05/2023,Ngoc Han Nguyen,4.0,"serum siêu tốt, mượt tóc mà ko làm xẹp bết tóc. mùi thơm nhẹ dễ chịu. nhưng chai nhựa quá sức dở. xài bóp vài lần là bể chai. mà ko bóp thì lại rất khó lấy serum ra"
308100016,09: 03 | 24/04/2023,Linh,4.0,"Xài tốt nhưng mà chai nhựa dở quá, mua 4 lần rồi mà bóp lần nào cũng bị vỡ chai"
308100016,19: 21 | 10/06/2022,lhgffc,5.0,uki rất được
308100016,00: 49 | 18/04/2022,Mỹ Vân,5.0,"Mùi thơm thảo mộc dễ chịu, chất sánh không gây bết dính, rất ưng"
308100016,23: 01 | 20/01/2022,hương,4.0,"Mới sử dụng gần 1 tháng hiện tại thấy ok, tóc mềm mượt ko bết và mùi cũng dễ chịu. phải sd thêm thời gian mới biết chính xác hơn."
308100016,20: 28 | 02/01/2022,Tran Thu Ha,5.0,"Bao bì đẹp. Đầu rót thiết kế khéo, không bị dây dính chất dầu ra nắp. Chất dầu trong và sánh. Mùi thảo mộc rất nhẹ, lúc mới bôi nghe thoảng mùi gì lạ quá (mùi hoa hồi) nhưng mùi rất nhẹ, không làm tóc có mùi. Tóc có mềm mượt hơn sau khi bôi. Và hoàn toàn không bị bết dính (hiệu quả không thua dầu dưỡng của l'oreal và goldwell đâu, nhưng không thơm). Các bạn có thể yên tâm dùng thử nếu muốn tìm sp chất lượng và không có dầu khoáng paraben"
308100016,21: 16 | 13/12/2021,Parsley,5.0,"mùi thơm xưa xưa quyến rũ, không gây bết dính, mới dùng chưa rõ tác dụng nhưng cũng có vẻ rụng tóc ít hơn"
308100016,09: 20 | 04/08/2021,Trần Thị Huế,5.0,Mua gần hết sản phẩm cocoon rồi ấy. Lành tính. Rất okellaaa
422204817,07: 28 | 04/07/2024,Trần Thị Hà Phương,3.0,"Được cái mùi thơm dễ chịu với xịt lên mát mát chứ không có tác dụng làm mượt tóc, đã xài hết chai và không mua lại."
422204817,11: 42 | 30/06/2024,XUÂN HIỀN,5.0,chất lượng sp rất ok thơm bóng tóc. Mà hông biết do gói hàng hay vận chuyển mà chai bị chảy còn quà tặng cho đơn từ 44k thì hổng có luon
422204817,10: 53 | 08/12/2023,Hải Yến Oanh,5.0, 
422204817,10: 47 | 08/12/2023,Thuỷ Tiên Nguyễn,5.0,"Tóc mình nhuộm nhiều lần rồi, sài bao nhiêu loại dầu gội không hết kh xịt cái này lên cái mượt hẳng"
422204817,09: 20 | 08/12/2023,Phạm thị lan anh,5.0,Thơm xỉu
422204817,20: 42 | 07/12/2023,Nguyễn thị nhường,5.0,Cải thiên toc rõ rệt .mùi hương thơm
422204817,11: 08 | 12/11/2023,Trần Phương Nhi,5.0,"xài tuyệt cú mèo luôn á nha mn, mà xài hằng ngày tóc mềm, chứ hog xài tóc cũng khô trở lại à"
422204817,12: 51 | 06/11/2023,NHI,5.0,"Mình hay dùng để ủ tóc  trước khi gội,  ủ ướt thân tóc và để tầm 1-2h sau đó gội đầu lại bình thường.
Gội xong tóc rất mềm mượt và thơm mặc dù tóc thuộc dạng khô xơ và bông xù. Từ hồi áp dụng tóc cải thiện nhiều, còn mà gội xong xịt thì hầu như k thấy tác dụng. Bạn nào tóc khô xơ có thể áp dụng thử cách trên của mình"
422204817,17: 44 | 06/10/2023,Bùi Ngọc Tường Vi,5.0,Thơm xĩu lên xĩu xuống luôn đó bà con 
422204817,23: 21 | 27/08/2023,Đỗ Ngọc Trúc Vy,5.0,Mình thấy chai này dùng ok gội đầu xong xịt thơm lắm nhưng hơi nhanh bay mùi nói chung ok về giá á mua 2 lần vẫn ok
422204817,21: 02 | 21/10/2022,Lê Thị Thanh Tài,5.0,"thơm, nhưnq dữ mùi không lâu. nhanh bết tóc"
422204817,20: 31 | 14/10/2022,Nguyễn Mỹ Hạnh,4.0,"Dùng thấy sp để lại trên tóc siêu mướt ạ dùng khi tóc ướt quá là mướt luôn ạ, mùi thì đại trà nma chất lượng siêu tốt ạ"
422204817,16: 08 | 12/10/2022,nguyen chau,5.0,chân ái cho tóc khô và chẻ ngọn mùi cực kì thơm
422204817,23: 57 | 06/10/2022,Nguyễn Ngọc Phương Quỳnh,4.0,"Dưỡng tóc rẻ, siêu thơm"
422204817,21: 14 | 18/09/2022,CAO MAI,5.0,"Dưỡng tóc giá rẻ mà mùi siêu thơm luôn, đi đâu ai cũng hỏi. 

Về khả năng dưỡng thì mình đánh giá tạm ổn, không bết tóc"
422204817,16: 17 | 06/09/2022,Đàng Nguyễn An Nhiên,5.0,Giá rẻ dung tích nhiều. mùi thơm nhẹ nhẹ. xịt vào tóc mượt. ko gây bết dính nhìu
422204817,09: 28 | 04/09/2022,Duyên Nguyễn,5.0,"Mềm tóc mùi dịu, giá hợp lý , nên mua"
422204817,16: 23 | 05/07/2022,Thu Thao,5.0,"Sản phẩm giữ được mùi hương khá lâu nha. Xịt chai này, thấy tóc mình mướt lắm."
422204817,20: 34 | 19/06/2022,Thu Hiền,5.0,Đây là cảm nhận của mình 
422204817,23: 08 | 18/06/2022,Kim Oanh,5.0,"Cực kì thích sp này, mùi thơm dịu nhẹ, giúp làm mềm mượt tóc và ko bị xơ rối"
