https://hasaki.vn/san-pham/combo-eucerin-lam-sach-sau-cho-da-mun-gel-rua-mat-toner-99397.html,https://media.hcdn.vn/catalog/product/f/a/facebook-dynamiccombo-eucerin-lam-sach-sau-cho-da-mun-gel-rua-mat-toner-1_img_385x385_622873_fit_center.jpg,422206482,Combo Eucerin Làm Sạch Sâu Cho Da Mụn (Gel Rửa Mặt + Toner) ,19,2,488.000 ₫,698.000 ₫,210.000 ₫,-30%,2.0,1,1,4005800310485,Eucerin,Ðức,Germany,,Tất cả,Da mụn,"
Gel Rửa Mặt Eucerin Cho Da Dầu Mụn 200ml
Thành phần đầy đủ:
Aqua, Sodium Cocoamphoacetate, Propylene Glycol, Sodium Laureth Sulfate, Sodium Chloride, Citric Acid, Sodium Benzoate, Salicylic Acid, Poloxamer 124, Decyl Glucoside, Arginine HCL, Trisodium EDTA, Phenoxyethanol.
Nước Cân Bằng Eucerin Dành Cho Da Nhờn Mụn 200ml
Thành phần đầy đủ:
Lactic Acid, Aqua, Alcohol Denat, Butylene Glycol, Poloxamer 124, Lactic Acid, PEG-40 Hydrogenated Castor Oil, Sodium Hydroxide, Glyceryl Caprylate, Phenoxyethanol, Parfum ","
Gel Rửa Mặt Eucerin Cho Da Dầu Mụn 200ml
- Làm ướt mặt, lấy 1 lượng vừa đủ sữa rửa mặt thoa nhẹ nhàng theo chuyển động tròn đều, sau đó rửa sạch lại bằng nước.
- Sử dụng vào buổi sáng và buổi tối hoặc khi muốn làm sạch da.
Nước Cân Bằng Eucerin Dành Cho Da Nhờn Mụn 200ml
- Dùng mỗi buổi sáng và tối, sau khi rửa mặt và trước khi dưỡng ẩm.
- Đổ nước hoa hồng lên miếng bông gòn và thoa lên mặt.
- Không cần rửa lại bằng nước. ",Ngày Và Đêm
https://hasaki.vn/san-pham/combo-la-roche-posay-kem-chong-nang-da-dau-spf50-50ml-gel-rua-mat-danh-cho-da-dau-nhay-cam-50ml-69238.html,https://media.hcdn.vn/catalog/product/f/a/facebook-dynamic-204900058-1700187870_img_385x385_622873_fit_center.jpg,204900058,Combo La Roche-Posay Chống Nắng Kiểm Soát Dầu & Làm Sạch Da,19,2,479.000 ₫,725.000 ₫,246.000 ₫,-34%,5.0,5,25,,La Roche-Posay,Pháp,France,"Da dầu, hỗn hợp dầu",Tất cả,"Da dầu, lỗ chân lông to","
Kem chống nắng La Roche-Posay UVMune 400 Oil Control Gel Cream 50ml 
Thành phần chính:


XL-PROTECT: màng lọc đã được cấp bằng sáng chế, cung cấp khả năng bảo vệ vượt trội khỏi tia UVA/UVB với quang phổ rộng và giúp ngăn ngừa các tác hại do ô nhiễm và tia hồng ngoại gây ra.


Công nghệ AIRLICIUM™: Các hạt phân tử siêu nhỏ với tác dụng thấm hút bã nhờn. Ngay lập tức thẩm thấu vào da và giúp kiểm soát tất cả các nguyên nhân khiến da nhờn bóng (bã nhờn, mồ hôi và độ ẩm).


Thành phần chi tiết:
Aqua / Water, Homosalate, Silica, Octocrylene, Ethylhexyl Salicylate, Butyl Methoxydibenzoylmethane, Ethylhexyl Triazone, Bis-Ethylhexyloxyphenol Methoxyphenyl Triazine, Drometrizole Trisiloxane, Aluminum Starch Octenylsuccinate, Glycerin, Pentylene Glycol, Styrene/Acrylates Copolymer, Potassium Cetyl Phosphate, Dimethicone, Perlite, Propylene Glycol, Acrylates/C10-30 Alkyl Acrylate Crosspolymer, Aluminum Hydroxide, P-Anisic Acid, Caprylyl Glycol, Disodium Edta, Inulin Lauryl Carbamate, Isopropyl Lauroyl Sarcosinate, Peg-8 Laurate, Phenoxyethanol, Scutellaria Baicalensis Extract / Scutellaria Baicalensis Root Extract, Silica Silylate, Stearic Acid, Stearyl Alcohol, Terephthalylidene Dicamphor Sulfonic Acid, Titanium Dioxide, Tocopherol, Triethanolamine, Xanthan Gum, Zinc Gluconate.
Gel Rửa Mặt Dành Cho Da Dầu, Nhạy Cảm La Roche-Posay Effaclar Purifying Foaming Gel For Oily Sensitive Skin 50ml
Aqua / Water, Sodium Laureth Sulfate, Peg-8, Coco-Betaine, Hexylene Glycol, Sodium Chloride, Peg-120 Methyl Glucose Dioleate, Zinc Pca, Sodium Hydroxide, Citric Acid, Sodium Benzoate, Phenoxyethanol, Caprylyl Glycol. ","
Kem chống nắng La Roche-Posay UVMune 400 Oil Control Gel Cream 50ml 
Bôi kem chống nắng trước khi tiếp xúc với ánh nắng ít nhất 20 phút. Nên thoa lại sau mỗi 2 giờ (khi tiếp xúc với nước hoặc chơi thể thao) để duy trì khả năng bảo vệ của kem. Tránh tiếp xúc vùng mắt, rửa sạch trong trường hợp tiếp xúc với mắt. Cần bôi kem chống nắng ngay cả lúc trời không có nắng.
Gel Rửa Mặt Dành Cho Da Dầu, Nhạy Cảm La Roche-Posay Effaclar Purifying Foaming Gel For Oily Sensitive Skin 50ml 
Làm ẩm da với nước ấm, cho một lượng vừa đủ sản phẩm ra tay, tạo bọt, thoa sản phẩm lên mặt, tránh vùng da quanh mắt. Massage nhẹ nhàng, sau đó rửa sạch lại với nước và thấm khô.
Sử dụng hằng ngày vào buổi sáng và tối.
Lưu ý khi sử dụng:
Tránh tiếp xúc với mắt. Trong quá trình sử dụng nếu thấy da có các biểu hiện khác thường như: xuất hiện các vết đỏ, ngứa, hay bị kích ứng thì phải ngưng sử dụng ngay và hỏi ý kiến tư vấn từ chuyên gia da liễu. ",
https://hasaki.vn/san-pham/gel-rua-mat-senz-chiet-xuat-tra-xanh-cap-am-sau-150ml-104931.html,https://media.hcdn.vn/catalog/product/f/a/facebook-dynamic-gel-rua-mat-senz-chiet-xuat-tra-xanh-cap-am-sau-150ml-1711966325_img_385x385_622873_fit_center.jpg,422210104,Gel Rửa Mặt Senz Chiết Xuất Trà Xanh Cấp Ẩm Sâu 150ml,19,12,78.000 ₫,125.000 ₫,47.000 ₫,-38%,4.8,10,1,8938542182019,Senz,Việt Nam,Vietnam,"Da khô, hỗn hợp khô",Tất cả,"Da khô, mất nước","
1. Sữa Rửa Mặt Senz Chiết Xuất Cám Gạo Dưỡng Sáng Da 150ml  
Thành phần chính:


Cám gạo: với hàm lượng lớn các Vitamin B1, Vitamin E có khả năng tăng sinh sản collagen, tái tạo tế bào, kháng khuẩn, tiêu viêm cồi mụn,… 


Vitamin C: dưỡng da sáng đều màu, giúp giảm thâm, giảm các nếp nhăn và ngăn ngừa lão hóa hiệu quả.


AHA: có công dụng tẩy tế bào chết và giảm tăng sắc tố ở da.


Thành phần đầy đủ:
Water, Glycerin, Propylene Glycol, Oryza Sativa Bran Extract, Avena Sativa Meal Extract, Chrysanthemum Indicum Flower Extract, Allantoin, Stearic Acid, Myristic Acid, Lauric Acid, Glycol Distearate, Potassium Hydroxide, Cocamidopropyl Betaine, Cocamide Dea, Tocopheryl Acetate, Phytosteryl/Octyldodecyl Lauroyl Glutamate,Niacinamide, Panthenol, Laureth-9, 3-O-Ethyl Ascorbic Acid, Phenoxyethanol, Ethylhexylglycerin, Glycolic Acid, Disodium Edta, Sodium Lactate, Perfume.
2. Gel Rửa Mặt Senz Chiết Xuất Trà Xanh Cấp Ẩm Sâu 150ml 
Thành phần chính:


Lá trà xanh: được chọn lọc từ hơn 2401 giống trà xanh Việt Nam chứa các loại amino acid khác nhau, đậm đặc gấp 3.5 lần so với trà xanh thông thường.


Nước trà xanh tươi: được cải tiến nhờ công nghệ tối ưu để lưu giữ được dưỡng chất trọn vẹn nhất.


Chiết xuất trà xanh: dưỡng ẩm chuyên biệt, giảm mẩn đỏ, kích ứng và ngăn ngừa lão hoá da.


Hyaluronic Acid: thẩm thấu sâu tế bào giúp da căng mọng, mịn màng, tăng sức đề kháng cho da nhờ kết hợp với nước.


Ceramide: dưỡng ẩm, cấp nước cho da, ngăn chặn các gốc oxi hoá, ngừa lão hoá da hiệu quả.


Thành phần đầy đủ:
Water, Glycerin, Propylene Glycol, Camellia Sinensis Leaf Extract, Aloe Barbadensis Leaf Extract, Chrysanthemum Indicum Flower Extract, Acrylates Copolymer, Decyl Glucoside, Cocamidopropyl Betaine, Allantoin, Tocopheryl Acetate, Phytosteryl/Octyldodecyl Lauroyl Glutamate, Niacinamide, Panthenol, Hyaluronic Acid, Triethanolamine, Peg-40 Hydrogenated Castor Oil, Polysorbate 80, Phenoxyethanol, Ethylhexylglycerin, Disodium EDTA, Citric Acid, Perfume.
3. Gel Rửa Mặt Senz Từ Khổ Qua Thu Nhỏ Lỗ Chân Lông 150ml
Thành phần chính:


Khổ qua: làm dịu tình trạng mụn, mờ vết thâm, dưỡng ẩm da, giảm tình trạng bong tróc và giảm nám gò má.


BHA: hỗ trợ làm sạch sâu lỗ chân lông. giảm lượng dầu thừa và thu nhỏ kích thước lỗ chân lông.


Niacinamide: tăng khả năng miễn dịch và tạo lớp màng bảo vệ cho da hiệu quả.


Thành phần đầy đủ:
Water, Glycerin, Propylene Glycol, Momordica Charantia Extract, Centella Asiatica Extract, Chamomilla Recutita Flower Extract, Vigna Radiata Seed Extract, Decyl Glucoside, Allantoin, Polysorbate 80, Niacinamide, Panthenol, Tocopheryl Acetate, Phytosteryl/Octyldodecyl Lauroyl Glutamate, Polyquaternium-10, Phenoxyethanol, Ethylhexylglycerin, Disodium Edta, Salicylic Acid, Sodium Lactate, Perfume. ","


Cho một lượng sữa rửa mặt vừa đủ ra tay để tạo bọt cùng với nước, mát-xa sản phẩm lên da và rửa sạch với nước.


Sử dụng mỗi ngày hai lần sáng và tối.


Để đạt được hiệu quả tốt nhất, kết hợp dùng kèm Nước Tẩy Trang cùng dòng trước khi rửa mặt.

 ",
https://hasaki.vn/san-pham/sua-rua-mat-biore-sang-min-duong-am-100g-78810.html,https://media.hcdn.vn/catalog/product/f/a/facebook-dynamic-213300068-1704187759_img_385x385_622873_fit_center.png,213300068,Sữa Rửa Mặt Bioré Thanh Lọc Da - Dưỡng Ẩm & Mịn Da 100g,19,19,49.000 ₫,52.000 ₫,3.000 ₫,-6%,4.7,6,15,8934681028010,Bioré,Nhật Bản,Vietnam,"Da khô, hỗn hợp khô",Tất cả,"Da khô, mất nước","
1. Sữa Rửa Mặt Bioré Thanh Lọc Da - Sạch Nhờn
Thành phần chính:


Đất sét trắng cùng với hạt siêu mịn: giúp hấp thụ dầu thừa và bã nhờn hiệu quả.


Thành phần chi tiết:
Water (Aqua), Sorbitol, Myristic Acid, Lauryl Hydroxysultaine, Laureth-4 Carboxylic Acid, Ethylhexylglycerin, Potassium Hydroxide, Cellulose, Zea Mays (Corn) Starch, Laureth-6 Carboxylic Acid, Lauric Acid, Palmitic Acid,...
2. Sữa Rửa Mặt Bioré Thanh Lọc Da - Ngừa Mụn
Thành phần chính:


Hoạt chất o-Cymen-5-ol: ngăn ngừa, làm giảm sự tích tụ của vi khuẩn gây mụn.


Triclosan: hoạt động như nam châm thông minh lấy sạch mọi bụi bẩn bã nhờn mà vẫn thật dịu nhẹ cho da.


Thành phần chi tiết:
Water (Aqua), Sorbitol, Glycerin, Myristic Acid, Laureth-4 Carboxylic Acid, Lauryl Hydroxysultaine, Potassium Hydroxide, Laureth-6 Carboxylic Acid, Lauric Acid, Acrylates/C10-30 Alkyl Acrylate Crosspolymer, Ethylhexylglycerin, Palmitic Acid,...
3. Sữa Rửa Mặt Bioré Thanh Lọc Da - Sáng Da
Thành phần chính:


Vitamin C: hỗ trợ dưỡng sáng da từ sâu bên trong.


Tinh chất trà xanh: chống oxy hóa, ngừa tổn thương da do gốc tự do.


Các hạt siêu mịn: giúp thanh tẩy tế bào chết cho da mềm mịn, thông thoáng, hạn chế tình trạng sạm da do tế bào chết ứ đọng.


Thành phần chi tiết:
Water, Sorbitol, Myristic Acid, Lauryl Hydroxysultaine, Laureth-4 Carboxylic Acid, Ethylhexylglycerin, Potassium Hydroxide, Laureth-6 Carboxylic Acid, Lauric Acid, Cellulose, Zea Mays (Corn) Starch, Palmitic Acid, Fragrance, Polyquaternium-7,…
4. Sữa Rửa Mặt Bioré Thanh Lọc Da - Dưỡng Ẩm & Mịn Da
Thành phần chính:


25% Glycerin: cung cấp độ ẩm sâu, cải thiện tình trạng da khô & thô ráp.


Thành phần chi tiết:
Water (Aqua), Glycerin, Stearic Acid, Myristic Acid, Laureth-6 Carboxylic Acid, Palmitic Acid, Potassium Hydroxide, Lauric Acid, Sorbitol, Polyquaternium-7, Propylene Glycol, Fragrance (Parfum), Disodium Edta, Methylparaben, Propylparaben,… ","


Làm ướt mặt, lấy một lượng sản phẩm vừa đủ ra lòng bàn tay và tạo bọt với nước. 


Thoa đều khắp mặt, mát-xa nhẹ nhàng, sau đó rửa sạch lại với nước.


Sử dùng hàng ngày vào mỗi buổi sáng và tối.

 ",Ngày Và Đêm
https://hasaki.vn/san-pham/sua-rua-mat-melano-cc-duong-sang-sach-sau-130g-115295.html,https://media.hcdn.vn/catalog/product/f/a/facebook-dynamic-sua-rua-mat-melano-cc-duong-sang-sach-sau-130g-1709712180_img_385x385_622873_fit_center.jpg,422216833,"Sữa Rửa Mặt Melano CC Dưỡng Sáng, Sạch Sâu 130g",19,6,153.000 ₫,180.000 ₫,27.000 ₫,-15%,0.0,0,0,4987241173242,Melano CC,Nhật Bản,Japan,Da thường/Mọi loại da,Tất cả,"Da sạm, xỉn, không đều màu","
Thành phần chính:


Đất sét: giúp hấp thụ bã nhờn và làm sạch sâu hỗ trợ làm thông thoáng, se khít lỗ chân lông.


Vitamin C (Ascorbic Acid): giúp dưỡng trắng, chống oxy hóa, làm đều màu và ẩm mịn da.


Thành phần chi tiết:
Glycerin, Water, Palmitic Acid, Myristic Acid, Potassium Hydroxide, Butylene Glycol, Diglycerin, Lauric Acid, Stearic Acid, Lauryl Glucoside, Ascorbic Acid, 3-O-Ethyl Ascorbic Acid, Protease, Propylene Glycol, Sodium Alginate, Hydroxypropyl Methylcellulose Stearoxy Ether, Polyquaternium-7, Kaolin, Titanium Dioxide, Aluminum Hydroxide, Glyceryl Stearate SE, BHT, Sodium Metabisulfite, Fragrance
 ","


Bước 1: Làm ướt mặt, lấy một lượng vừa đủ (2-3 cm) vào lòng bàn tay.


Bước 2: Tạo bọt, thoa đều khắp mặt và rửa lại với nước sạch.


Dùng hàng ngày, sáng và tối.


Kết hợp sử dụng trọn bộ dưỡng trắng Melano CC để đạt hiệu quả tối ưu.

 ",
https://hasaki.vn/san-pham/gel-rua-mat-topicrem-khong-xa-phong-cho-da-dau-hon-hop-200ml-103191.html,https://media.hcdn.vn/catalog/product/f/a/facebook-dynamic-gel-rua-mat-topicrem-khong-xa-phong-cho-da-dau-hon-hop-200ml-1708746504_img_385x385_622873_fit_center.png,422209102,Gel Rửa Mặt Topicrem Không Xà Phòng Cho Da Dầu Hỗn Hợp 200ml,19,3,305.000 ₫,380.000 ₫,75.000 ₫,-20%,5.0,1,2,3700281702774,Topicrem,Pháp,France,"Da dầu, hỗn hợp dầu",Tất cả,"Da dầu, lỗ chân lông to","
Thành phần chính: 


Kẽm Gluconate (Zinc Gluconate): giúp điều chỉnh lượng bã nhờn dư thừa, làm giảm bóng nhờn da. Kẽm Gluconate của Topicrem có độ tinh khiết hơn 97%.


Allantoin: làm dịu da, giảm kích ứng.


Chất hoạt động bề mặt dịu nhẹ (Sodium Laureth Sulfate, Sodium Cocoamphoacetate): giúp làm sạch da dịu nhẹ mà không gây khô căng.


Thành phần chi tiết: Water, Sodium Laureth Sulfate, Glycerin, Sodium Cocamphoacetate, Coco-Glucoside, Glyceryl Oleate, Zinc Gluconate, Myristyl PCA, Sodium Chloride, Glyceryl Caprylate, Phenoxyethanol, Allantoin, Citric Acid, Acrylates/C10-30 Alkyl Acrylate Crosspolymer, Sodium Hydroxide, Tocopherol, Sodium Sulfate, Hydrogenated Palm Glycerides Citrate, Parfum. 
 ","


Thoa lên da mặt ướt, massage tạo bọt và rửa sạch lại với nước.


Lưu ý: Rửa kỹ với nước nếu dính vào mắt.

 ",
https://hasaki.vn/san-pham/sua-rua-mat-biore-cho-nam-hat-tac-dong-kep-sach-nhon-100g-90727.html,https://media.hcdn.vn/catalog/product/f/a/facebook-dynamic-422200703-1704186125_img_385x385_622873_fit_center.png,422200703,Sữa Rửa Mặt Bioré Cho Nam Hạt Tác Động Kép Sạch Nhờn 100g,19,16,55.000 ₫,65.000 ₫,10.000 ₫,-15%,0.0,0,0,8934681129557,Bioré,Nhật Bản,,"Da dầu, hỗn hợp dầu",Nam,"Da dầu, lỗ chân lông to","
Nội dung đang được cập nhật ","


Làm ướt mặt.


Cho sữa rửa mặt vào lòng bàn tay, hòa tan với nước để tạo bọt.


Mát xa nhẹ nhàng lên mặt.


Rửa lại sạch với nước.


Dùng 2 lần mỗi sáng và tối.

 ",Ngày Và Đêm
https://hasaki.vn/san-pham/sua-rua-mat-torriden-tao-bot-duong-am-da-150ml-116957.html,https://media.hcdn.vn/catalog/product/f/a/facebook-dynamic-422217957-1706239436_img_385x385_622873_fit_center.png,422217957,Sữa Rửa Mặt Torriden Tạo Bọt Dưỡng Ẩm Da 150ml,19,5,194.000 ₫,330.000 ₫,136.000 ₫,-41%,0.0,0,0,8809784600404,Torriden,Hàn Quốc,Korea,"Da khô, hỗn hợp khô",Tất cả,"Da khô, mất nước","
Thành phần chính:


Phức hợp 8 loại phân tử Hyaluronic Acid trọng lượng phân tử cao, trung bình và thấp cung cấp độ ẩm mà không gây khô căng sau khi rửa mặt.


Axit Amin thành phần tự nhiên có nguồn gốc từ Dừa tạo nhiều bọt mềm mịn giúp bảo vệ da đồng thời rửa sạch mọi tạp chất trên da.


Panthenol, Allantoin: giúp dưỡng ẩm và làm dịu da.


Thành phần chi tiết:
Water, Glycerin, Sodium Cocoyl Glycinate, Sodium Lauroyl Glutamate, Sodium Hyaluronate, Hyaluronic Acid, Hydrolyzed Hyaluronic Acid, Sodium Acetylated Hyaluronate, Hydroxypropyltrimonium Hyaluronate, Hydrolyzed Sodium Hyaluronate, Sodium Hyaluronate Crosspolymer, Potassium Hyaluronate, Panthenol, Allantoin, Trehalose, Tocopherol, Hamamelis Virginiana (Witch Hazel) Extract, Camellia Sinensis Leaf Extract, Chamomilla Recutita (Matricaria) Extract, Butylene Glycol, Dipropylene Glycol, Hydroxypropyl Starch Phosphate, Glyceryl Stearate SE, Potassium Benzoate, Sodium Chloride, Polyquaternium-67, Sodium Acetate, 1,2-Hexanediol, Citric Acid, Ethylhexylglycerin, Disodium EDTA, Malachite Extract
 ","


Cho một lượng sữa rửa mặt vừa đủ và tạo nhiều bọt bong bóng sữa rửa mặt rồi mát xa nhẹ nhàng toàn bộ da mặt.


Rửa sạch mặt bằng nước ấm và tiếp tục các bước dưỡng da tiếp theo.

 ",Thuần Chay (Vegan)
https://hasaki.vn/san-pham/bo-doi-svr-lam-sach-cho-da-dau-mun-103591.html,https://media.hcdn.vn/catalog/product/f/a/facebook-dynamic-bo-doi-svr-lam-sach-cho-da-dau-mun-1664168117_img_385x385_622873_fit_center.jpg,422209345,Combo SVR Làm Sạch Cho Da Dầu Mụn,19,1,789.000 ₫,970.000 ₫,181.000 ₫,-19%,0.0,0,0,8936206910022,SVR,Pháp,,"Da dầu, hỗn hợp dầu",Tất cả,"Da dầu, lỗ chân lông to","
1.  Nước Tẩy Trang SVR Sebiaclear Eau Micellaire 
Thành phần chính:


Gluconolactone: làm sạch và làm thông thoáng lỗ chân lông.


Micelles: tẩy trang và làm sạch da.


Thành phần đầy đủ:
Aqua (purified Water), Poloxamer 184, Peg-7 Glyceryl Cocoate, Pentylene Glycol, Propanediol, Gluconolactone, 1,2-hexanediol, Citric Acid, Sodium Hydroxide, Cetrimonium Bromide, Parfum (fragrance).
2. Gel Rửa Mặt SVR Sebiaclear Gel Moussant
Thành phần chính: 


Gluconolactone với tác động giảm viêm và tiêu sừng, giúp làm sạch da và thông thoáng lỗ chân lông. Hiệu quả tương tự như AHAs với độ dung nạp tốt hơn.


Niacinamide có tác dụng giảm khuẩn và điều tiết bã nhờn.


Các tác nhân làm sạch dịu nhẹ giúp làm sạch hiệu quả trong khi vẫn giữ vững sự cân bằng cho làn da nhạy cảm.


Mat SR (2%) giúp điều hòa lượng bã nhờn dư thừa, cho làn da không bóng dầu.


Thành phần chi tiết: 
Aqua (Purified Water), Disodium Laureth Sulfosuccinate, Coco-Betaine, Peg-7 Glyceryl Cocoate, Glycerin, Sodium Laureth Sulfate, Gluconolactone, Peg-120 Methyl Glucose Dioleate, Calcium Gluconate, Sarcosine, Butylene Glycol, Lactic Acid, Pentylene Glycol, Sodium Chloride, Sodium Hydroxide, Xanthan Gum, Sodium Benzoate, Fragrance ","
1. Nước Tẩy Trang SVR Sebiaclear Eau Micellaire


Sử dụng bông cotton thấm đều dung dịch, lau lên mặt và mắt vào buổi sáng và / hoặc tối.


Sau đó rửa mặt lại với Gel Rửa Mặt SVR Sebiaclear Gel Moussant 


2. Gel Rửa Mặt SVR Sebiaclear Gel Moussant 


Sử dụng mỗi ngày 2 lần vào buổi sáng và tối.


Cho lượng gel rửa mặt bằng khoảng 1 đồng xu ra tay, tạo bọt và massage lên da ướt, sau đó rửa sạch. 

 ",2 in 1
https://hasaki.vn/san-pham/sua-rua-mat-biore-sang-hong-tu-nhien-100g-78808.html,https://media.hcdn.vn/catalog/product/g/o/google-shopping-sua-rua-mat-biore-thanh-loc-da-sang-da-100g-1668667286_img_385x385_622873_fit_center.jpg,213300069,Sữa Rửa Mặt Bioré Thanh Lọc Da - Sáng Da 100g,19,16,49.000 ₫,52.000 ₫,3.000 ₫,-6%,4.7,6,15,8934681028072,Bioré,Nhật Bản,Vietnam,Da thường/Mọi loại da,Tất cả,"Da sạm, xỉn, không đều màu","
1. Sữa Rửa Mặt Bioré Thanh Lọc Da - Sạch Nhờn
Thành phần chính:


Đất sét trắng cùng với hạt siêu mịn: giúp hấp thụ dầu thừa và bã nhờn hiệu quả.


Thành phần chi tiết:
Water (Aqua), Sorbitol, Myristic Acid, Lauryl Hydroxysultaine, Laureth-4 Carboxylic Acid, Ethylhexylglycerin, Potassium Hydroxide, Cellulose, Zea Mays (Corn) Starch, Laureth-6 Carboxylic Acid, Lauric Acid, Palmitic Acid,...
2. Sữa Rửa Mặt Bioré Thanh Lọc Da - Ngừa Mụn
Thành phần chính:


Hoạt chất o-Cymen-5-ol: ngăn ngừa, làm giảm sự tích tụ của vi khuẩn gây mụn.


Triclosan: hoạt động như nam châm thông minh lấy sạch mọi bụi bẩn bã nhờn mà vẫn thật dịu nhẹ cho da.


Thành phần chi tiết:
Water (Aqua), Sorbitol, Glycerin, Myristic Acid, Laureth-4 Carboxylic Acid, Lauryl Hydroxysultaine, Potassium Hydroxide, Laureth-6 Carboxylic Acid, Lauric Acid, Acrylates/C10-30 Alkyl Acrylate Crosspolymer, Ethylhexylglycerin, Palmitic Acid,...
3. Sữa Rửa Mặt Bioré Thanh Lọc Da - Sáng Da
Thành phần chính:


Vitamin C: hỗ trợ dưỡng sáng da từ sâu bên trong.


Tinh chất trà xanh: chống oxy hóa, ngừa tổn thương da do gốc tự do.


Các hạt siêu mịn: giúp thanh tẩy tế bào chết cho da mềm mịn, thông thoáng, hạn chế tình trạng sạm da do tế bào chết ứ đọng.


Thành phần chi tiết:
Water, Sorbitol, Myristic Acid, Lauryl Hydroxysultaine, Laureth-4 Carboxylic Acid, Ethylhexylglycerin, Potassium Hydroxide, Laureth-6 Carboxylic Acid, Lauric Acid, Cellulose, Zea Mays (Corn) Starch, Palmitic Acid, Fragrance, Polyquaternium-7,…
4. Sữa Rửa Mặt Bioré Thanh Lọc Da - Dưỡng Ẩm & Mịn Da
Thành phần chính:


25% Glycerin: cung cấp độ ẩm sâu, cải thiện tình trạng da khô & thô ráp.


Thành phần chi tiết:
Water (Aqua), Glycerin, Stearic Acid, Myristic Acid, Laureth-6 Carboxylic Acid, Palmitic Acid, Potassium Hydroxide, Lauric Acid, Sorbitol, Polyquaternium-7, Propylene Glycol, Fragrance (Parfum), Disodium Edta, Methylparaben, Propylparaben,… ","


Làm ướt mặt, lấy một lượng sản phẩm vừa đủ ra lòng bàn tay và tạo bọt với nước. 


Thoa đều khắp mặt, mát-xa nhẹ nhàng, sau đó rửa sạch lại với nước.


Sử dùng hàng ngày vào mỗi buổi sáng và tối.

 ",Ngày Và Đêm
https://hasaki.vn/san-pham/kem-rua-mat-mat-na-ngan-ngua-mun-dau-den-acnes-100g-69860.html,https://media.hcdn.vn/catalog/product/f/a/facebook-dynamic-kem-rua-mat-mat-na-ngan-ngua-mun-dau-den-acnes-100g-1696412327_img_385x385_622873_fit_center.jpg,226200014,Kem Rửa Mặt & Mặt Nạ Acnes Ngăn Ngừa Mụn Đầu Đen 100g,19,12,68.000 ₫,80.000 ₫,12.000 ₫,-15%,0.0,0,8,8935006538900,Acnes,Nhật Bản,Vietnam,Da thường/Mọi loại da,Tất cả,,"
Water, Kaolin, Propylene Glycol, Salicylic Acid, Glycerin, Glyceryl Stearate, Hydroxypropyl Starch Phosphate, Sodium Stearoyl Glutamate,  Cetyl Alcohol, Potassium Laureth Phosphate, Behenyl Alcohol, Magnesium Aspartate, Zinc Gluconate, Copper Gluconate, Jojoba Esters, Bentonite, Titanium Dioxide (CI 77891), Xanthan Gum, Potassium Hydroxide, Phenoxyethanol, Aluminum Hydroxide, Ammonium Polyacrylate, Butylene Glycol, Ethylhexylglycerin, L-Menthol, Disodium EDTA, Fragrance. ","
- Kem rửa mặt: Làm ướt mặt. Lấy lượng kem vừa đủ thoa trực tiếp lên mặt và nhẹ nhàng mát-xa trong 30 - 60 giây (mát-xa nhiều hơn ở những vùng có mụn đầu đen), sau đó rửa sạch với nước. Sử dụng 2 lần/ ngày (sáng & tối).
- Mặt nạ chuyên sâu: Sau khi rửa mặt sạch, thoa một lớp kem mỏng lên vùng da có mụn đầu đen và nhẹ nhàng mát-xa trong 30 - 60 giây. Để lớp mặt nạ trên da khoảng 3 phút rồi rửa sạch với nước. Sử dụng 1 – 2 lần/ tuần. ",2 in 1
https://hasaki.vn/san-pham/gel-rua-mat-oxy-ngua-mun-da-sang-khoe-100g-104007.html,https://media.hcdn.vn/catalog/product/g/o/google-shopping-gel-rua-mat-oxy-ngua-mun-da-sang-khoe-100g-1664961652_img_385x385_622873_fit_center.jpg,422209608,"Gel Rửa Mặt OXY Ngừa Mụn, Da Sáng Khoẻ 100g",19,12,65.000 ₫,86.000 ₫,21.000 ₫,-24%,0.0,0,0,8935006544659,OXY,Nhật Bản,Vietnam,Da thường/Mọi loại da,Nam,Da mụn,"
Thành phần chính: 


Các tinh thể hạt mát-xa trà xanh: Làm sạch sâu, giảm mụn


Chiết xuất Camu Camu: 40X Vitamin C cho da sáng khỏe 


Pionin: kháng khuẩn, ngăn hình thành nhân mụn mới


Thành phần chi tiết: 
Water, Glycerin, Sodium Cocoyl Glycinate, Sorbitol, Sodium Cocoyl Isethionate, Acrylates Copolymer, Cocamide Methyl MEA, Cocamidopropyl Betaine, Disodium Cocoyl Glutamate, Decyl Glucoside, Sodium PCA, Hydroxypropyltrimonium Hyaluronate, Dihydroxypropyl Arginine HCl, Myrciaria Dubia (Camu Camu) Fruit Extract, Oryza Sativa (Rice) Bran Wax, Camellia Sinensis (Green Tea) Leaf Extract, Quaternium-73 (Pionin), Maltooligosyl Glucoside, Hydrogenated Starch Hydrolysate, Hydroxypropyl Methylcellulose, Polyquaternium-7, Polyquaternium-73, Sodium Metabisulfite, Disodium EDTA, Phenoxyethanol, Methylparaben, Propylparaben, Sodium Benzoate, Fragrance, CI 19140, CI 42090. ","


Bước 1: Làm ướt tay và mặt.


Bước 2: Lấy lượng kem vừa đủ vào lòng bàn tay.


Bước 3: Tạo bọt kỹ và thoa đều khắp mặt.


Bước 4: Rửa sạch với nhiều nước.

 ",Ngày Và Đêm
