https://hasaki.vn/san-pham/combo-senka-sua-rua-mat-dat-set-120g-sua-tam-huong-hoa-diu-ngot-500ml-97677.html,https://media.hcdn.vn/catalog/product/p/r/promotions-auto-combo-senka-sua-rua-mat-dat-set-120g-sua-tam-huong-hoa-diu-ngot-500ml_cUAegRpx3BF92PLH_img_385x385_622873_fit_center.png,422205439,Combo Senka Sữa Tắm Hương Hoa Dịu Ngọt 500ml & Sữa Rửa Mặt Đất Sét Trắng 120g,19,0,245.000 ₫,268.000 ₫,23.000 ₫,-9%,0.0,0,0,,Senka,Nhật Bản,Japan,,Tất cả,,"
Sữa Rửa Mặt Đất Sét Trắng Loại Bỏ Tế Bào Chết & Làm Sáng Da Senka Perfect White Clay 120g
Water (Aqua), Stearic Acid, Myristic Acid, PEG-8, Potassium Hydroxide, Lauric Acid, Glycerin, Dipropylene Glycol, Alcohol, Talc, Beeswax (Cera Alba), Titanium Dioxide (Cl 77891), Polyquaternium-7, Sericin, Fragrance (Parfum), Disodium EDTA, PEG-90M, Sodium Benzoate, Sodium Metabisulfite, Potassium Sorbate, Aluminum Hydroxide, Hydrolized Silk, Sodium Hyaluronate, Citric Acid, Sodium Metaphosphate, Silica, BHT, Sodium Acetylated Hyaluronate.
Sữa Tắm Dưỡng Ẩm Hương Hoa Dịu Ngọt Senka Perfect Bubble For Body Sweet Floral 500ml
Water, Lauric Acid, PG, Potassium Hydroxide, Myristic Acid, Palmitic Acid, Oleic Acid, Glycol Distearate, Fragrances, Cocamide DEA, Sodium Lauryl Glycol Carboxylate, Sodium Methyl Cocoyl Taurate, PPG-10 Glyceryl Ether, Polyquarternium-7, Polyquarternium-39, Sodium Hyaluronate, Sericin, Phellodendron Amurense Bark Extract, Sodium Acetylated Hyaluronate, Cocamide Propyl Betaine, Stearic Acid, Hydroxypropyl Methylcellulose, EDTA-2Na、Sodium Metabisulfite, Ethanol, Citric Acid, BHT, Potassium Sorbate, Sodium Benzoate. ","
Sữa Rửa Mặt Đất Sét Trắng Loại Bỏ Tế Bào Chết & Làm Sáng Da Senka Perfect White Clay 120g


Rửa tay thật sạch.


Lấy một lượng sữa rửa mặt khoảng 2cm, thêm vào lòng bàn tay một ít nước sau đó đánh bọt bằng tay hoặc lưới tạo bọt.


Áp bọt lên mặt và massage nhẹ nhàng trong 1-2 phút, sau đó rửa lại thật sạch với nước.


Sữa Tắm Dưỡng Ẩm Hương Hoa Dịu Ngọt Senka Perfect Bubble For Body Sweet Floral 500ml


Làm ướt cơ thể.


Lấy một lượng sữa tắm ra bông, tạo bọt sau đó massage lên toàn thân.


Sau 2-3 phút, tắm sạch lại với nước.


Dùng sữa tắm hàng ngày.

 ",
https://hasaki.vn/san-pham/mua-1-tang-1-eucerin-gel-giam-mun-40ml-gel-rua-mat-cho-da-nhon-mun-75ml-107323.html,https://media.hcdn.vn/catalog/product/f/a/facebook-dynamic-422211906-1699434108_img_385x385_622873_fit_center.jpg,422211906,[Mua 1 Tặng 1] Eucerin Gel Giảm Mụn 40ml + Gel Rửa Mặt Cho Da Nhờn Mụn 75ml,19,0,469.000 ₫,689.000 ₫,220.000 ₫,-32%,0.0,0,0,4005800335334,Eucerin,Ðức,Germany,"Da dầu, hỗn hợp dầu",Tất cả,Da mụn,"
1. Gel Dưỡng Eucerin Pro ACNE Solution A.I Clearing Treatment Giảm Mụn 40ml
Thành phần chính:


10% Hydroxy Complex (AHA, BHA và PHA):



AHA: loại bỏ tế bào chết cho da, hỗ trợ giảm mụn, cung cấp độ ẩm, dưỡng da mềm mại. 


BHA: giảm mụn, tái tạo da, làm se khít lỗ chân lông và giúp da mịn màng hơn. 


PHA: làm sạch da, ngăn ngừa mụn, kháng khuẩn, cung cấp độ ẩm và ngăn ngừa lão hóa.



Chiết xuất rễ cây cam thảo Licochalcone A: kháng viêm và giảm đỏ, làm dịu bề mặt da, ngăn chặn sự hình thành và phát triển của các mụn mới và ngăn mụn quay trở lại.


Thành phần đầy đủ: 
Aqua, Glycolic Acid, Dimethicone, Glycerin, Cetearyl Alcohol, Glyceryl Stearate, Sodium Hydroxide, Gluconolactone, PEG-40 Stearate, Salicylic Acid, PEG-150 Distearate, Glycyrrhiza Inflata Root Extract, Panthenol, Xanthan Gum, Trisodium EDTA, Phenoxyethanol, Parfum.
2. Gel Rửa Mặt Eucerin Pro ACNE Solution Cleansing Gel Cho Da Nhờn Mụn 75ml
Thành phần chính: 


Chứa 6% Ampho-Tensides: giúp loại bỏ bã nhờn dư thừa, làm sạch bụi bẩn trên da và ngăn ngừa vi khuẩn.




Sản phẩm đã được chứng minh lâm sàng về độ dịu nhẹ, không chứa xà phòng và hương liệu, không gây khô da, hiệu quả cao trên da nhờn, mụn.


Thành phần đầy đủ:
Aqua, Sodium Cocoamphoacetate, Propylene Glycol, Sodium Laureth Sulfate, Sodium Chloride, Citric Acid, Sodium Benzoate, Salicylic Acid, Poloxamer 124, Decyl Glucoside, Arginine HCL, Trisodium EDTA, Phenoxyethanol. ","
1. Gel Dưỡng Eucerin Pro ACNE Solution A.I Clearing Treatment Giảm Mụn 40ml


Sử dụng 1 lần/ngày (vào buổi tối) hoặc 2 lần/ngày (sáng và tối) tùy tình trạng mụn viêm nhiều hay ít.


Nếu dùng buổi sáng, bắt buộc sử dụng kết hợp kem chống nắng.


Sau khi rửa mặt sạch, thoa một lượng nhỏ (cỡ bằng hạt đậu) sản phẩm Eucerin Pro ACNE Solution A.I Clearing Treatment lên vùng da cần điều trị. 


Nhẹ nhàng massage để tinh chất thẩm thấu hoàn toàn vào da. Tránh để tiếp xúc với mắt của bạn.


Kết hợp với các sản phẩm cùng dòng Pro Acne để mang lại hiệu quả tốt nhất.


2. Gel Rửa Mặt Eucerin Pro ACNE Solution Cleansing Gel Cho Da Nhờn Mụn 75ml


Làm ướt mặt, lấy 1 lượng vừa đủ sữa rửa mặt thoa nhẹ nhàng theo chuyển động tròn đều, sau đó rửa sạch lại bằng nước.




Sử dụng vào buổi sáng và buổi tối hoặc khi muốn làm sạch da.

 ",
https://hasaki.vn/san-pham/bo-san-pham-vichy-box-refresh-02-cap-am-tuc-thi-lam-sach-da-3-mon-87735.html,https://media.hcdn.vn/catalog/product/f/a/facebook-dynamic-201600180-1693451635_img_385x385_622873_fit_center.jpg,201600180,Bộ Sản Phẩm Vichy 02 Cấp Ẩm & Làm Sạch Da 3 Món,19,0,579.000 ₫,620.000 ₫,41.000 ₫,-7%,0.0,0,1,8935274606462,Vichy,Pháp,,Da thường/Mọi loại da,,,"
Xịt Khoáng Dưỡng Da VICHY Thermal Spa Water 150ml
Được làm giàu tự nhiên với 15 khoáng chất quý hiếm bao gồm sắt, potassium, canxi, manganese, silicon,... 
Sữa Rửa Mặt Dạng Gel Làm Sạch Sâu Cho Da Nhờn, Mụn Vichy Normaderm Phytosolution Intensive Purifying Gel 50ml
Aqua / Water, Sodium Laureth Sulfate, Peg-8, Coco-Betaine, Hexylene Glycol, Sodium Chloride, Peg-120 Methyl Glucose Dioleate, Ci 19140 / Yellow 5, Ci 42053 / Green 3, Glycolic Acid, Triethanolamine, Salicylic Acid, Sodium Benzoate, Sodium Hydroxide, Dipotassium Glycyrrhizate, Caprylyl Glycol, Capryloyl Salicylic Acid, Citric Acid, Parfum / Fragrance ","
Xịt Khoáng Dưỡng Da VICHY Thermal Spa Water 150ml
Xịt khắp mặt - Vỗ nhẹ - Thấm khô. Có thể sử dụng nhiều lần trong ngày.
Sữa Rửa Mặt Dạng Gel Làm Sạch Sâu Cho Da Nhờn, Mụn Vichy Normaderm Phytosolution Intensive Purifying Gel 50ml
- Sử dụng 2 lần/ngày vào buổi sáng và tối.
- Làm ướt da mặt, cho lượng sữa rửa mặt vừa đủ ra tay và tạo bọt, massage lên da sau đó rửa sạch lại với nước ấm. 
- Thấm khô da. ",
https://hasaki.vn/san-pham/bo-doi-la-roche-posay-nuoc-tay-trang-lam-sach-cho-da-thuong-97873.html,https://media.hcdn.vn/catalog/product/f/a/facebook-dynamic-422205551-1700103499_img_385x385_622873_fit_center.png,422205551,Combo La Roche-Posay Tẩy Trang & Rửa Mặt Cho Da Thường,19,0,447.000 ₫,640.000 ₫,193.000 ₫,-30%,0.0,0,2,,La Roche-Posay,Pháp,France,Da thường/Mọi loại da,Tất cả,"Da nhạy cảm, kích ứng, mẩn đỏ","
Nước Tẩy Trang La Roche-Posay Dành Cho Da Nhạy Cảm 400ml

Nước khoáng La Roche-Posay: làm dịu da, chống oxy hóa.

Glycerin: dưỡng ẩm da.


Aqua / Water, Peg-7 Caprylic/Capric Glycerides, Poloxamer 124, Poloxamer 184, Peg-6 Caprylic/Capric Glycerides, Glycerin, Polysorbate 80, Disodium Edta, Bht, Myrtrimonium Bromide, Parfum / Fragrance.
Gel Rửa Mặt La Roche-Posay Dành Cho Da Dầu, Nhạy Cảm 50ml
Thành phần đầy đủ:
Aqua / Water, Sodium Laureth Sulfate, Peg-8, Coco-Betaine, Hexylene Glycol, Sodium Chloride, Peg-120 Methyl Glucose Dioleate, Zinc Pca, Sodium Hydroxide, Citric Acid, Sodium Benzoate, Phenoxyethanol, Caprylyl Glycol, Parfum / Fragrance ","
Nước Tẩy Trang La Roche-Posay Dành Cho Da Nhạy Cảm 400ml


Cho nước tẩy trang ra bông cotton, nhẹ nhàng lau toàn mặt và vùng mắt môi nếu có makeup.


Lặp lại cho đến khi thấy miếng bông đã sạch hoàn toàn.


Không cần rửa lại với nước.


Gel Rửa Mặt La Roche-Posay Dành Cho Da Dầu, Nhạy Cảm 50ml


Làm ẩm da với nước ấm, cho một lượng vừa đủ sản phẩm ra tay, tạo bọt, thoa sản phẩm lên mặt, tránh vùng da quanh mắt. Massage nhẹ nhàng, sau đó rửa sạch lại với nước và thấm khô.


Sử dụng hằng ngày vào buổi sáng và tối.


Lưu ý khi sử dụng: Tránh tiếp xúc với mắt.


Trong quá trình sử dụng nếu thấy da có các biểu hiện khác thường như: xuất hiện các vết đỏ,  ngứa, hay bị kích ứng thì phải ngưng sử dụng ngay và hỏi ý kiến tư vấn từ chuyên gia da liễu.


 Peg-8, Coco-Betaine, Hexylene Glycol, Sodium Chloride, Peg-120 Methyl Glucose Dioleate, Zinc Pca, Sodium Hydroxide, Citric Acid, Sodium Benzoate, Phenoxyethanol, Caprylyl Glycol, Parfum / Fragrance

 ",
https://hasaki.vn/san-pham/sua-rua-mat-aplb-glutathione-niacinamide-duong-sang-da-80ml-123004.html,https://media.hcdn.vn/catalog/product/p/r/promotions-auto-sua-rua-mat-aplb-glutathione-niacinamide-duong-sang-da-80ml_JLgqejZpmqmj2SNJ_img_385x385_622873_fit_center.png,422220574,Sữa Rửa Mặt APLB Glutathione Niacinamide Dưỡng Sáng Da 80ml,19,0,231.000 ₫,240.000 ₫,9.000 ₫,-4%,0.0,0,0,8809874682723,APLB,Hàn Quốc,Korea,Da thường/Mọi loại da,Tất cả,"Da sạm, xỉn, không đều màu","
Thành phần chính:


LIPO GLUTA NIAC CEN™ 8.6% (Glutathione 1,000ppm, Niacinamide 1,000ppm, Centella Asiatica Extract 8.4%): loại bỏ bụi bẩn, cấp ẩm, cải thiện nếp nhăn, làm mờ các vết thâm.

Soft Deep Cleansing System™™ X APLB Facial Cleanser: Với công thức tạo bọt thấm sâu vào da giúp làm sạch sâu cấp ẩm mà không gây căng da.

Microfluidizer X Glutathione: giúp làn da trắng sáng.


Thành phần chi tiết:
Water, Glycerin, Stearic Acid, Centella Asiatica Extract (8.4%), Lauric Acid, Potassium Hydroxide, Myristic Acid, 1,2-Hexanediol, Glycol Distearate, Coco-glucoside, Potassium Cocoyl Glycinate, Sorbitan Olivate, Glutathione (1,000ppm), Beeswax, Niacinamide (1,000ppm), Glyceryl Stearate, PEG-100 Stearate, Polysorbate 60, Nelumbo Nucifera Extract, Artemisia Annua Extract, Oryza Sativa (Rice) Extract, Saccharomyces Ferment, Butylene Glycol, Solanum Melongena (Eggplant) Fruit Extract, Melaleuca Alternifolia (Tea Tree) Leaf Extract, Hydrolyzed Collagen, Beta-Glucan, Hippophae Rhamnoides Fruit Extract, Dipropylene Glycol, Hydroxypropyl Methylcellulose, Madecassic Acid, Asiaticoside, Asiatic Acid, Squalane, Sodium Hyaluronate, Disodium EDTA, Caprylic/Capric Triglyceride, Hydrogenated Lecithin, Cholesterol, Xanthan Gum ","


Sau khi làm ướt mặt bằng nước, lấy một lượng sữa rửa mặt vừa đủ tạo bọt và massage nhẹ nhàng để làm sạch da mặt, sau đó rửa mặt lại bằng nước sạch. 


Sử dụng sáng và tối để có hiệu quả tốt nhất.

 ",
https://hasaki.vn/san-pham/gel-rua-mat-elixir-ho-tro-lam-sach-duong-am-180g-123868.html,https://media.hcdn.vn/catalog/product/p/r/promotions-auto-gel-rua-mat-elixir-ho-tro-lam-sach-duong-am-180g_LwXmsC6WqTUYtG24_img_385x385_622873_fit_center.png,422222323,"Gel Rửa Mặt Elixir Hỗ Trợ Làm Sạch, Dưỡng Ẩm 180g",19,0,444.000 ₫,550.000 ₫,106.000 ₫,-19%,0.0,0,0,4909978123345,Elixir,Nhật Bản,Japan,Da thường/Mọi loại da,Tất cả,"Da khô, mất nước","
Thành phần chính:


Sữa ong chúa và mật ong: Làm chậm hóa trình lão hóa và cấp ẩm cho da.


Chiết xuất cúc La Mã: Chống lão hóa, duy trì sự căng mọng, mịn mượt cho làn da.


Thành phần chi tiết:
Peg-8, Glycerin, Butylene Glycol, Peg-20 Glyceryl Isostearate, Water (Aqua), Carbomer, Fragrance (Parfum), Aminomethyl Propanol, Honey (Mel), Alcohol, Sodium Methyl Cocoyl Taurate, Prunus Speciosa Leaf Extract, Lavandula Angustifolia (Lavender) Oil, Phenoxyethanol, Royal Jelly Extract, Chamomilla Recutita (Matricaria) Flower Extract, Paeonia Suffruticosa Root Extract, Soluble Collagen, Serine. ","


Lấy một lượng bằng hạt hạnh nhân ra lòng bàn tay, thoa đều lên toàn bộ khuôn mặt và xoa nhẹ nhàng để loại bỏ bụi bẩn bám trên bề mặt da.


Sau đó, rửa kỹ bằng nước hoặc nước ấm.


LƯU Ý:


Tránh tiếp xúc với mắt. Nếu có, rửa ngay bằng nước ấm. 


Ngưng dùng ngay khi có biểu hiện kích ứng và tham khảo ý kiến bác sĩ da liễu.


Tránh nắng trực tiếp, để xa tầm tay trẻ em.


Các hạt trong gel có thể khác nhau về kích thước, nhưng sẽ không ảnh hưởng đến chất lượng sản phẩm.


Không sử dụng cho vùng da bị tổn thương.

 ",
https://hasaki.vn/san-pham/sua-rua-mat-dr-pepti-tao-bot-lam-sach-sau-lo-chan-long-110ml-101961.html,https://media.hcdn.vn/catalog/product/g/o/google-shopping-sua-rua-mat-dr-pepti-tao-bot-lam-sach-sau-lo-chan-long-110ml-1655970008_img_385x385_622873_fit_center.jpg,422208016,Sữa Rửa Mặt Dr.Pepti Tạo Bọt Làm Sạch Sâu Lỗ Chân Lông 110ml,19,0,165.000 ₫,307.000 ₫,142.000 ₫,-46%,5.0,1,1,8809331318561,Dr.Pepti,Hàn Quốc,Korea,Da thường/Mọi loại da,Tất cả,,"
Thành phần chính:


Copper Tripeptide-1: có công dụng kích thích sản sinh collagen, chống oxy hoá và cải thiện bề mặt da.


Venucean: giúp làn da giữ nguyên vẻ tươi trẻ và rạng ngời giúp da sáng mịn.


Tinh chất lên men Galactomyces Ferment Filtrate 10.4%: khôi phục lại độ tươi trẻ mịn màng cho da.


Thành phần đầy đủ: 
Glycerin, Stearic Acid, Sorbitol, Purified Water, Galactomyces Fermentation Filtrate (11.4525%), Myristic Acid, Potassium Hydroxide, Lauric Acid, Butylene Glycol, 1,2-Hexanediol, Sodium Methyl Cocoyl Taurate, PEG-8, Glycol Distearate, Fragrance, Glyceryl Stearate, Betaine, PEG-100 Stearate, Potassium Cocoyl Glycinate, Thermous Thermophilus Fermented Product, Bacillus /Folic Acid/Fermented Soybean Extract, Ethylhexylglycerin, Linalool, Illite, Disodium EDTA, Lactobacillus/Fermented Soybean Extract, Lactobacillus/Fermented Pomegranate Extract, Lactobacillus/Fermented Rice, Lactobacillus/Fermented Pumpkin Extract, Lactobacillus/Fermented Algae Extract, Palmitic Acid, Montmorillonite, Limonene, Propanediol, Kaolin, Potassium Sorbate, PEG-40 Hydrogenated Castor Oil, PG-26-Butes-26, Caprylyl Glycol, Copper Tripeptide-1 ","


Cho một lượng sữa rửa mặt ra tay và tạo bọt kĩ.


Thoa đều sữa rửa mặt lên mặt. 


Rửa sạch với nước.


Dùng khăn khô thấm sạch nước trên bề mặt da.

 ",
https://hasaki.vn/san-pham/sua-rua-mat-avander-tao-bien-duong-am-sang-da-100g-103465.html,https://media.hcdn.vn/catalog/product/f/a/facebook-dynamic-422209267-1703221134_img_385x385_622873_fit_center.png,422209267,Sữa Rửa Mặt Avander Tảo Biển Dưỡng Ẩm Sáng Da 100g,19,0,69.000 ₫,89.000 ₫,20.000 ₫,-22%,0.0,0,0,8936173950403,Avander,Việt Nam,Vietnam,Da thường/Mọi loại da,Tất cả,"Da khô, mất nước","
1. Sữa Rửa Mặt Thảo Mộc Avander Kiểm Soát Dầu, Ngừa Mụn 100g
Thành phần chính:


Chiết xuất từ hơn 11 loại Thảo mộc và Thực vật: giúp làm sạch sâu, lấy đi bụi bẩn, bã nhờn, dầu thừa một cách nhẹ nhàng và dịu da.


Salicylic Acid: giúp loại bỏ dầu cho da, thông thoáng lỗ chân lông, hỗ trợ ngăn ngừa mụn.


Glycerin: dưỡng ẩm, duy trì độ ẩm lâu dài trên da.


Thành phần chi tiết:
Water, Butylene Glycol, Glycerin, Lauric Acid, Stearic Acid, Myristic Acid, Cocamidopropyl Betaine, Potassium Hydroxide, Propylene Glycol, Phenoxyethanol, Xanthan Gum, Disodium Edta, Ethylhexylglycerin, Propanediol, Salicylic Acid, Myrciaria Dubia Seed Extract, Lilium Candidum Flower Extract, Glycyrrhiza Glabra Root Extract, Bellis Perennis Flower Extract, Dipotassium Glycyrrhizate, Garcinia Mangostana Peel Extract, Fragaria Chiloensis Fruit Extract, Citrus Unshiu Peel Extract, Citrus Junos Seed Extract, Actinidia Chinensis Seed Extract, Vitis Vinifera Leaf/Seed/Skin Extract, Fragrance.
2. Sữa Rửa Mặt Tảo Biển Avander Dưỡng Ẩm Sáng Da 100g
Thành phần chính:


Chiết xuất dịch Ốc Sên: hỗ trợ sửa chữa, phục hồi và tái tạo da, ngăn ngừa lão hoá.


Nước biển sâu: cấp nước cho da.


Chiết xuất Tảo Biển: làm dịu và bảo vệ da.


Glycerin: dưỡng ẩm, duy trì độ ẩm lâu dài trên da.


Thành phần chi tiết:
Water, Butylene Glycol, Glycerin, Lauric Acid, Stearic Acid, Myristic Acid, Cocamidopropyl Betaine, Potassium Hydroxide, Propylene Glycol, Phenoxyethanol, Xanthan Gum, Disodium Edta, Snail Secretion Filtrate, Undaria Pinnatifida Extract, Sea Water, Ethylhexylglycerin, Fragrance, 1,2-Hexanediol, Ci 42090 ","


Làm ướt mặt và tay, cho một lượng sản phẩm vừa đủ ra lòng bàn tay.


Thoa đều khắp mặt và mát xa nhẹ nhàng.


Rửa sạch với nhiều nước.

 ",Ngày Và Đêm
https://hasaki.vn/san-pham/sua-rua-mat-milaganics-tinh-dau-tram-tra-ngua-mun-30ml-101859.html,https://media.hcdn.vn/catalog/product/f/a/facebook-dynamic-sua-rua-mat-milaganics-tinh-dau-tram-tra-ngua-mun-30ml-1655454658_img_385x385_622873_fit_center.jpg,422208030,[Mini] Sữa Rửa Mặt Milaganics Tinh Dầu Tràm Trà Ngừa Mụn 30ml,19,0,35.000 ₫,36.000 ₫,1.000 ₫,-3%,5.0,1,0,8936089078338,Milaganics,Việt Nam,Vietnam,Da thường/Mọi loại da,Tất cả,Da mụn,"
Thành phần chính: 


Cocamidopropyl Betaine, Disodium Cocoyl Glutamate, Sodium Lauroyl Sarcosinate: các hợp chất chiết xuất từ dầu dừa mang công dụng làm sạch da, không gây khô căng và kích ứng


Aloe Barbadensis Leaf Extract – chiết xuất nha đam: làm dịu, tái tạo da, cấp ẩm


Glycereth-26: hoạt chất dưỡng ẩm cho da


Panthenol – Vitamin B5: có khả năng giữ ẩm, hạn chế sự mất nước cho da, tránh được hiện tượng khô da và tổn thương da. Vitamin B5 có khả năng phân giải lượng dầu thừa trên da từ đó có thể hạn chế khả năng hình thành mụn trứng cá


Salicylic Acid – BHA: hoạt chất trị mụn có khả năng thấm sâu, giúp thanh lọc lỗ chân lông, kháng khuẩn  loại bỏ các tế bào chết cho da


Hamamelis Virginiana Leaf Extract – chiết xuất cây phỉ: Làm sạch dịu nhẹ, chống oxy hóa, chống viêm hỗ trợ trị mụn


Melaleuca Alternifolia Leaf Oil – tinh dầu tràm trà: Làm sạch và dịu da, giúp ngăn ngừa mụn, kiểm soát bã nhờn, cân bằng độ dầu trên da, kháng viêm, chống khuẩn, giảm kích ứng, tấy đỏ Mentha Piperita Oil – tinh dầu bạc hà: giúp thư giãn tinh thần và làm dịu làn da mệt mỏi vào cuối ngày tạo cảm giác tươi mới khi sử dụng.


Thành phần chi tiết: 


Aqua, Aloe Barbadensis Leaf Extract, Sodium Lauroyl Sarcosinate, Cocamidopropyl Betaine, Glycereth-26, Disodium Cocoyl Glutamate, Glycerin, Betaine, PEG-7 Glyceryl Cocoate, Panthenol, Salicylic Acid, Hamamelis Virginiana Leaf Extract, PEG-40 Hydrogenated Castor Oil, Melaleuca Alternifolia Leaf Oil, Mentha Piperita Oil, DMDM Hydantoin, Disodium EDTA,Triethanolamine.

 ","


Làm ướt mặt. 


Sử dụng một lượng sản phẩm vừa đủ cho vào lòng bàn tay hòa với nước và xoa đều tạo bọt.


Sau đó apply lên da, massage thư giãn từ 2-3 phút.


Rửa mặt lại với nước. Sử dụng kết hợp quy trình chăm sóc da mụn từ Tràm Trà của Milaganics để đem lại hiệu quả tốt nhất. 

 ",
https://hasaki.vn/san-pham/combo-2-gel-rua-mat-nerman-ngua-mun-cho-nam-100mlx2-104289.html,https://media.hcdn.vn/catalog/product/f/a/facebook-dynamic-422209694-1703301549_img_385x385_622873_fit_center.png,422209694,Combo 2 Gel Rửa Mặt Nerman Ngừa Mụn Cho Nam 100ml ,19,0,289.000 ₫,298.000 ₫,9.000 ₫,-3%,0.0,0,3,,Nerman,Việt Nam,Vietnam,Da thường/Mọi loại da,Nam,Da mụn,"
Thành phần chính: 


Curcumin dạng nano: Đây là thành phần tự nhiên có tác dụng sạch sâu, hỗ trợ ngừa mụn, hỗ trợ tái tạo nhanh da. Dạng nano với kích thước phân tử siêu nhỏ giúp Curcumin thấm sâu vào lớp da để phát huy tối đa tác dụng.


Chiết xuất lô hội: làm sáng da, cân bằng sắc tố cho da, giúp xoá bỏ các vùng da tối màu

 ","


Bước 1: Rửa sạch tay bằng xà phòng. Làm ướt mặt.


Bước 2: Lấy 1 lượng gel rửa mặt vừa đủ, thoa đều sản phẩm ra lòng bàn tay, sau đó massage đều trên mặt trong vòng 15 – 30s.


Bước 3: Rửa lại với nhiều nước và lau khô bằng bông tẩy trang

 ",
https://hasaki.vn/san-pham/bot-rua-mat-senka-sach-sau-diu-nhe-150ml-107748.html,https://media.hcdn.vn/catalog/product/p/r/promotions-auto-bot-rua-mat-senka-sach-sau-diu-nhe-150ml_yHYmN5GnHANia5J1_img_385x385_622873_fit_center.png,422212098,Bọt Rửa Mặt Senka Sạch Sâu Dịu Nhẹ 150ml,19,0,186.000 ₫,225.000 ₫,39.000 ₫,-17%,0.0,0,0,4909978703592,Senka,Nhật Bản,Japan,"Da khô, hỗn hợp khô",Tất cả,"Da nhạy cảm, kích ứng, mẩn đỏ","
Thành phần chính:


Với hạt bọt siêu nhỏ amino: nhẹ nhàng làm sạch sâu bã nhờn, loại bỏ bụi bẩn gây bít tắc lỗ chân lông và tế bào chết.


Chiết xuất gạo Nhật và mật ong: giúp cân bằng ẩm và phục hồi độ ẩm nhanh chóng, cho da ẩm mịn, đàn hồi, hạn chế tình trạng chảy xệ, ngừa lão hóa da.


Chiết xuất tơ tằm trắng và gấp đôi Hyaluronic Acid: bảo vệ màng ẩm tự nhiên của da, giúp da ẩm mịn và đàn hồi. 


Thành phần đầy đủ:
Water (Aqua), Sorbitol, Dipropylene Glycol, Glycerin, Sodium Cocoyl Glycinate, Peg-60 Glyceryl Isostearate, Sodium Laureth Sulfate, Sodium Cocoamphoacetate, Phenoxyethanol, Peg-90 Glyceryl Isostearate, Peg-80 Sorbitan Laurate, Peg-240/Hdi Copolymer Bis-Decyltetradeceth-20 Ether, Sodium Methyl Cocoyl Taurate, Fragrance (Parfum), Polyquaternium-7, Citric Acid, Potassium Chloride,Disodium Edta, Honey (Mel), Peg/Ppg-14/7 Dimethyl Ether, Sodium Metabisulfite, Sericin, Sodium Benzoate, Tocopherol, Bht, Potassium Sorbate, Serine, Butylene Glycol, Sodium Acetylated Hyaluronate, Sodium Hyaluronate, Hydrolyzed Rice Extract ","


Làm ướt tay.


Lấy một lượng vừa đủ (khoảng 2-3 lần ấn) ra lòng bàn tay.


Mát-xa mặt với bọt theo chuyển động tròn.


Rửa lại thật sạch với nước.

 ",Không Paraben
https://hasaki.vn/san-pham/combo-senka-sua-rua-mat-tao-bot-120g-sua-tam-duong-am-500ml-97679.html,https://media.hcdn.vn/catalog/product/p/r/promotions-auto-combo-senka-sua-rua-mat-tao-bot-120g-sua-tam-duong-am-500ml_5mtgRxdL2KiR2qqZ_img_385x385_622873_fit_center.png,422205440,Combo Senka Sữa Tắm Dưỡng Ẩm 500ml & Sữa Rửa Mặt Perfect Whip 120g,19,0,235.000 ₫,258.000 ₫,23.000 ₫,-9%,0.0,0,0,,Senka,Nhật Bản,Japan,,Tất cả,,"
Sữa Tắm Dưỡng Ẩm Senka Perfect Whip For Body 500ml
Cyclopentasiloxane, C15-19 Alkane, Dimethiconol, Phenyl trimethicone, Plukenetia volubilis (Inca Inchi) seed oil, Phospholipid, Glycine soja (soybean) sterols, Olea europaea (olive) fruit oil, Cocos nucifera (coconut) oil, Macadamia integrifolia (Macadamia) seed oil, Carthamus tinctorius (safflower) seed oil, Ocimum gratissmum, (Holy basil) herb oil, Amodime thicone, Dimethicone, Dimethicone/Vinyl demethicone crosspolymer, Tocopheryl acetate, BHT.
Sữa Rửa Mặt Tạo Bọt Chiết Xuất Tơ Tằm Trắng Senka Perfect Whip 120g
Water, Potassium Stearate, PEG-8, Potassium Myristate, Glycerin, Potassium Laurate, Dipropylene Glycol, Stearic Acid, Butylene Glucol, Glyceryl Stearate Se, Myristic Acid, Lauric Acid, Polyquaternium-7, Beeswax Phytosteryl/Octyldodecyl Lauroyl Glotamate, Disodium EDTA, Fragrance. ","
Sữa Tắm Dưỡng Ẩm Senka Perfect Whip For Body 500ml


Mở khóa đầu bơm bằng cách giữ nắp có gân khi xoay vòi ngược chiều kim đồng hồ.


Lấy một lượng sản phẩm vừa đủ vào bông tắm hoặc miếng bọt biển được làm ẩm bằng nước và tạo bọt.


Xoa bọt khắp cơ thể & làm sạch lại với nước.


Sữa Rửa Mặt Tạo Bọt Chiết Xuất Tơ Tằm Trắng Senka Perfect Whip 120g


Bước 1: Rửa tay sạch.


Bước 2: Lấy lượng sữa rửa mặt khoảng 1 đốt ngón tay.


Bước 3: Thêm vào lòng bàn tay 1 ít nước.


Bước 4: Áp bọt lên mặt và massage nhẹ nhàng.


Bước 5: Rửa lại thật sạch với nước.


 ",
