https://hasaki.vn/san-pham/combo-2-sua-rua-mat-vichy-dang-gel-lam-sach-sau-da-dau-mun-50ml-114721.html,https://media.hcdn.vn/catalog/product/f/a/facebook-dynamic-422216487-1699936172_img_385x385_622873_fit_center.png,422216487,Combo 2 Sữa Rửa Mặt Vichy Dạng Gel Làm Sạch Sâu Da Dầu Mụn 50ml,19,34,150.000 ₫,280.000 ₫,130.000 ₫,-46%,4.8,23,52,,Vichy,Pháp,France,"Da dầu, hỗn hợp dầu",Tất cả,Da mụn,"
Thành phần chính:


Zinc oxide: Kháng viêm, giảm vi khuẩn gây mụn 


Copper: Điều tiết bã nhờn, giảm bóng dầu, hỗ trợ làm lành da


Salicylic Acid: Giúp làm sạch tế bào chết, thanh lọc da


Probiotic Bifidus: Phục hồi và củng cố khả năng tự phòng vệ của da


Thành phần đầy đủ:
Aqua / Water, Sodium Laureth Sulfate, Peg-8, Coco-Betaine, Hexylene Glycol, Sodium Chloride, Peg-120 Methyl Glucose Dioleate, Ci 19140 / Yellow 5, Ci 42053 / Green 3, Glycolic Acid, Triethanolamine, Salicylic Acid, Sodium Benzoate, Sodium Hydroxide, Dipotassium Glycyrrhizate, Caprylyl Glycol, Capryloyl Salicylic Acid, Citric Acid, Parfum / Fragrance ","
- Sử dụng 2 lần/ngày vào buổi sáng và tối.
- Làm ướt da mặt, cho lượng sữa rửa mặt vừa đủ ra tay và tạo bọt, massage lên da sau đó rửa sạch lại với nước ấm. 
- Thấm khô da. ",
https://hasaki.vn/san-pham/sua-rua-mat-uno-tao-bot-sach-nhon-cho-da-dau-130g-106945.html,https://media.hcdn.vn/catalog/product/f/a/facebook-dynamic-422211530-1706072060_img_385x385_622873_fit_center.jpg,422211530,Sữa Rửa Mặt Cho Nam Uno Tạo Bọt Sạch Nhờn Cho Da Dầu 130g,19,54,94.000 ₫,119.000 ₫,25.000 ₫,-21%,5.0,1,3,4901872449675,UNO,Nhật Bản,Vietnam,"Da dầu, hỗn hợp dầu",Nam,"Da dầu, lỗ chân lông to","
1. Sữa Rửa Mặt Uno Tạo Bọt Dạng Hạt Sáng Da Cho Da Sần 130g
Thành phần chính: 


Bọt đất sét khoáng: tạo lớp bọt dày và mịn giúp làm sạch bã nhờn, bụi bẩn sâu bên trong lỗ chân lông, mụn đầu đen, tế bào da chết gây thô ráp, sần và sạm da.


Chiết xuất bạc hà: đem lại cảm giác mát lạnh, sảng khoái cùng mùi hương tươi mát.


Thành phần đầy đủ: 

Water, Stearic Acid, Myristic Acid, PEG-8, Potassium Hydroxide, Lauric Acid, Glycerin, DPG, Microcrystalline Cellulose, Menthol, Beeswax, PEG-90M, Tocopheryl Acetate, Ethanol, Talc, EDTA-2Na, Ethylcellulose, Silica, BHT, Fragrance, Ultramarines

2. Sữa Rửa Mặt Uno Tạo Bọt Sạch Nhờn Cho Da Dầu 130g
Thành phần chính: 


Bọt đất sét khoáng: giúp tạo lớp bọt dày và mịn giúp làm sạch bã nhờn, bụi bẩn sâu bên trong lỗ chân lông.


Than hoạt tính: loại bỏ dầu thừa cho làn da sạch sâu, hạn chế dầu nhờn.


Chiết xuất bạc hà: đem lại cảm giác mát lạnh, sảng khoái cùng mùi hương tươi mát.


Thành phần đầy đủ: 
Water, Glycerin, Stearic Acid, Myristic Acid, Potassium Hydroxide, Lauric Acid, PEG-8, Glyceryl Stearate (SE), Sodium Methyl Cocoyl Taurate, Menthol, Magnesium Aluminometasilicate, Charcoal, Acrylates Copolymer, EDTA-2Na, Sodium Citrate, Talc, Fragrance ","


Làm ướt mặt.


Lấy 1 lượng vừa đủ (khoảng 2-3 cm), tạo nhiều bọt với một ít nước, mát xa mặt.


Rửa lại thật sạch với nước.

 ",
https://hasaki.vn/san-pham/bo-doi-hada-labo-sua-rua-mat-lotion-duong-am-da-thuong-92445.html,https://media.hcdn.vn/catalog/product/f/a/facebook-dynamic-422202168-1700214018_img_385x385_622873_fit_center.png,422202168,Combo Hada Labo Kem Rửa Mặt & Lotion Dưỡng Ẩm Da Thường,19,23,219.000 ₫,261.000 ₫,42.000 ₫,-16%,5.0,2,2,,Hada Labo,Nhật Bản,Vietnam,,Tất cả,"Da khô, mất nước","
Kem Rửa Mặt Hada Labo Dưỡng Ẩm Tối Ưu Advanced Nourish Hyaluron Cleanser
Hydroxypropyltrimonium Hyaluronate, Sodium Acetylated Hyaluronate, Hydrolyzed Hyaluronic Acid, Water, Glycerin, Sodium Cocoyl Glycinate, Butylene Glycol, Cocamidopropyl Betaine, Hydroxypropyl Starch Phosphate, PEG-20M, Lauryl Glucoside, Sodium Lauroyl Aspartate, Potassium Cocoyl Glycinate, Sodium Stearoyl Glutamate, Cananga Odorata (Ylang Ylang) Flower Oil, Polyquaternium-7, Polyquaternium-52, Hydroxypropyl Methylcellulose, PEG-32, Citric Acid, Lauric Acid, Stearic Acid, Glyceryl Stearate SE, PEG-60 Glyceryl Stearate, BHT, Disodium EDTA, Methylparaben, Propylparaben.
Dung Dịch Hada Labo Dưỡng Ẩm Tối Ưu Da Thường, Khô Advanced Nourish Hyaluron Lotion (Dry Skin)
Sodium Hyaluronate, Sodium Acetyl Hyaluronate, Hydrolyzed Hyaluronic Acid, Water, Butylene Glycol, Glycerin, PPG- 10 Methyl Glucose Ether, Hydroxyethylcellulose, Succinic Acid, Disodium Succinate, Methylparaben. ","
Kem Rửa Mặt Hada Labo Dưỡng Ẩm Tối Ưu Advanced Nourish Hyaluron Cleanser
- Bước 1: Lấy lượng Kem rửa mặt bằng hạt đậu.
- Bước 2: Thêm nước và tạo bọt trong lòng bàn tay.
- Bước 3: Áp bọt lên mặt và massage nhẹ nhàng theo chuyển động tròn từ dưới lên trên, từ trong ra ngoài.
- Bước 4: Rửa thật sạch với nước.
Dung Dịch Hada Labo Dưỡng Ẩm Tối Ưu Da Thường, Khô Advanced Nourish Hyaluron Lotion (Dry Skin)
- Bước 1: Làm sạch da mặt với các bước tẩy trang/rửa mặt.
- Bước 2: Vỗ Dung dịch dưỡng ẩm.
+ Cho 2-3 giọt dung dịch ra lòng bàn tay.
+ Áp nhẹ hai bàn tay vào nhau.
+ Vỗ nhẹ lên mặt: hai má, trán và cằm. ",2 in 1
https://hasaki.vn/san-pham/sua-rua-mat-paula-s-choice-can-bang-am-giam-dau-thua-237ml-2326.html,https://media.hcdn.vn/catalog/product/f/a/facebook-dynamic-100190049-1698832615_img_385x385_622873_fit_center.jpg,100190049,"Sữa Rửa Mặt Paula’s Choice Cân Bằng Ẩm, Giảm Dầu Thừa 237ml",19,7,699.000 ₫,,,,0.0,0,6,0655439011501,Paula's Choice,Mỹ,United States,"Da dầu, hỗn hợp dầu",Tất cả,"Da dầu, lỗ chân lông to","

Thành phần chính: 


Sodium Cocoyl Isethionate và Sodium Lauroamphoacetate: thành phần làm sạch dịu nhẹ có nguồn gốc từ dầu dừa, giúp loại bỏ tạp chất và bã nhờn trên da hiệu quả mà không gây khô căng / kích ứng da.


Dầu Hạt Hướng Dương (Sunflower Seed Oil): chống oxy hóa, làm mềm và dưỡng ẩm da.


Chiết xuất Nha Đam (Aloe Barbadensis): cấp nước, làm dịu mát da.


Glycerin: dưỡng ẩm và làm mềm da.


Thành phần đầy đủ:
Water (Aqua), Sodium Cocoyl Isethionate (cleansing), Sodium Lauroamphoacetate (cleansing), Stearic Acid (texture-enhancing), Glycerin (hydration/skin replenishing), Glycol Distearate (texture-enhancing), Helianthus Annuus Seed Oil (sunflower oil/non-fragrant oil/antioxidant), Acrylates Copolymer (texture-enhancing), Cetearyl Alcohol (texture-enhancing), Aloe Barbadensis Leaf Extract (hydration/skin-soothing), Sodium Chloride (stabilizer), Sodium Hydroxide (pH balancing), Xanthan Gum (texture-enhancing), Caprylyl Glycol (preservative), Hexylene Glycol (preservative), Disodium EDTA (stabilizer), Phenoxyethanol (preservative).

 ","


Làm ướt mặt, lấy 1 lượng nhỏ sữa rửa mặt thoa nhẹ nhàng theo chuyển động tròn đều, sau đó rửa sạch lại bằng nước.
Lặp lại một lần nữa để loại sạch sâu lớp trang điểm.
Dùng 2 lần/ngày vào buổi sáng và buổi tối.


 ",
https://hasaki.vn/san-pham/sua-rua-mat-bio-essence-vang-24k-ngan-ngua-lao-hoa-100g-11569.html,https://media.hcdn.vn/catalog/product/f/a/facebook-dynamic-222600028-1702369719_img_385x385_622873_fit_center.png,222600028,Sữa Rửa Mặt Bio-essence Vàng 24K Ngăn Ngừa Lão Hoá 100g,19,34,146.000 ₫,172.000 ₫,26.000 ₫,-15%,5.0,4,10,8888176026923,Bio-essence,Singapore,,Da thường/Mọi loại da,,"Da lão hóa, nếp nhăn","


Tinh chất Vàng 24K: rửa sạch sâu, đánh thức khả năng tái tạo và cải thiện độ đàn hồi của da.


Chiết xuất lá Bạch Quả: loại sạch bụi bẩn gây hại.


Hyaluronic Acid: dưỡng da tươi mới, ẩm mịn ngay sau khi sử dụng.

 ","
Lấy 1 lượng vừa đủ sản phẩm ra tay, tạo bọt và massage nhẹ nhàng trên da, sau đó rửa sạch với nước. ",Ngày Và Đêm
https://hasaki.vn/san-pham/sua-rua-mat-embryolisse-lam-sach-sau-chong-oxy-hoa-200ml-113969.html,https://media.hcdn.vn/catalog/product/f/a/facebook-dynamic-422215947-1698207275_img_385x385_622873_fit_center.png,422215947,"Sữa Rửa Mặt Embryolisse Làm Sạch Sâu, Chống Oxy Hóa 200ml",19,17,284.000 ₫,385.000 ₫,101.000 ₫,-26%,4.0,1,1,3350900000264,Embryolisse,Pháp,France,Da thường/Mọi loại da,Tất cả,,"
Aqua (Water), Sodium Laureth Sulfate, Glycol Distearate, Cocamidopropyl Betaine, Coco-Glucoside, Acrylates/C10-30 Alkyl Acrylate Crosspolymer, Phenoxyethanol, Perfume (Fragrance), Glycerin, Sodium Benzoate, Phospholipids, Glycine Soja (Soybean) Oil, Sodium Hydroxide, Potassium Sorbate, Ethylhexylglycerin, Glycolipids, Citric Acid, Opuntia Ficus-Indica Stem Extract, Glycine Soya (Soybean) Sterol ","


Tẩy trang bằng sản phẩm tẩy trang phù hợp với từng loại da.


Làm ướt mặt bằng nước ấm để lỗ chân lông giãn nở, giúp sữa rửa mặt dễ dàng thẩm thấu vào da và làm sạch da hiệu quả hơn.


Cho một lượng sữa rửa mặt vừa đủ vào lòng bàn tay, sau đó tạo bọt và nhẹ nhàng thoa lên mặt.


Massage sữa rửa mặt trên da khoảng 30 giây, sau đó rửa lại mặt với nước sạch và tiếp tục các bước chăm sóc da.

 ",Không Xà Phòng
https://hasaki.vn/san-pham/combo-2-sua-rua-mat-cetaphil-diu-lanh-cho-da-nhay-cam-125ml-moi-118488.html,https://media.hcdn.vn/catalog/product/p/r/promotions-auto-combo-2-sua-rua-mat-cetaphil-diu-lanh-cho-da-nhay-cam-125ml-moi_KJXVsT4cVKfJR3c4_img_385x385_622873_fit_center.png,422218631,Combo 2 Sữa Rửa Mặt Cetaphil Dịu Lành Cho Da Nhạy Cảm 125ml (Mới),19,19,249.000 ₫,330.000 ₫,81.000 ₫,-25%,4.5,31,96,,Cetaphil,Canada,Canada,Da nhạy cảm,Tất cả,"Da nhạy cảm, kích ứng, mẩn đỏ","
Thành phần chính:



Glycerin giúp ngăn ngừa hiện tượng khô da.


Niacinamide (B3) giúp củng cố hàng rào bảo vệ da.


Panthenol (B5) giúp làm dịu và phục hồi làn da.



Thành phần chi tiết:
Aqua, Glycerin, Cetearyl Alcohol, Panthenol, Niacinamide, Pantolactone, Xanthan Gum, Sodium Cocoyl Isethionate, Sodium Benzoate, Citric Acid. FIL.1747.V00 ","


Hướng dẫn rửa mặt khô: Lấy một lượng vừa đủ sữa rửa mặt thoa lên da và xoa nhẹ nhàng. Làm sạch phần sữa rửa mặt thừa bằng khăn mềm, để lại trên da cảm giác sạch nhẹ nhàng mà vẫn mịn màng.


Hướng dẫn rửa mặt với nước: Thoa đều sữa rửa mặt lên da và massage nhẹ nhàng. Sau đó rửa sạch lại với nước.


CHU TRÌNH CHĂM SÓC DA NHẠY CẢM
1. Rửa mặt, làm sạch da dịu nhẹ vào mỗi buổi sáng và tối
Thích hợp sử dụng cho mọi loại da, kể cả da nhạy cảm, Sữa rửa mặt dịu nhẹ Cetaphil Gentle Skin Cleanser giúp loại bỏ bụi bẩn, lớp trang điểm và các tạp chất một cách hiệu quả, đồng thời vẫn duy trì màng ẩm tự nhiên của da.
2. Khóa ẩm trên da với kem dưỡng ẩm ban ngày
Sau khi rửa mặt, hãy nhanh chóng thoa Kem dưỡng ẩm khi da vẫn còn ẩm để da dễ dàng ngậm nước và có tác dụng khoá ẩm dài lâu.
Vào ban ngày, nên sử dụng Kem dưỡng ẩm có chứa SPF để bảo vệ da mặt dưới ánh nắng. Kem dưỡng ẩm da mặt hàng ngày Daily Facial Moisturizer với SPF 15 vừa mang đến khả năng dưỡng ẩm mịn mượt giúp khoá chặt độ ẩm cần thiết để nuôi dưỡng làn da, vừa giúp bảo vệ da các khỏi tác hại từ tia cực tím UVA và UVB.
3. Sử dụng Kem dưỡng ẩm ban đêm để cấp ẩm, tái tạo & phục hồi cho da
Đừng quên sử dụng Kem dưỡng ẩm ban đêm Cetaphil Moisturizing Cream trước khi đi ngủ nhé. Với thành phần axit hyaluronic có trong sản phẩm sẽ giúp tăng khả năng trữ nước và dưỡng ẩm cho da, bảo vệ da không bị khô suốt đêm cho da luôn trông thật tươi tắn và rạng rỡ vào sáng hôm sau. ",Không Cồn
https://hasaki.vn/san-pham/sua-rua-mat-b-o-m-tu-8-loai-tra-lam-sach-sau-da-150ml-81715.html,https://media.hcdn.vn/catalog/product/p/r/promotions-auto-sua-rua-mat-b-o-m-tu-8-loai-tra-lam-sach-sau-da-150ml_NJ69cxCHqvmvubcj_img_385x385_622873_fit_center.png,343100041,Sữa Rửa Mặt B.O.M Từ 8 Loại Trà Làm Sạch Sâu Da 150ml,19,19,257.000 ₫,348.000 ₫,91.000 ₫,-26%,4.4,8,4,8809587524419,B.O.M,Hàn Quốc,,Da thường/Mọi loại da,Tất cả,,"
Thành phần chính:


Chiết xuất 8 loại trà bao gồm: trà xanh, trà đen, trà bạc hà, trà hoa cúc, trà lài, trà quýt Jeju Yuju: giàu đặc tính chống oxy hóa, làm dịu da, kháng viêm, thích hợp cho những làn da nhạy cảm.


Sử dụng chất hoạt động bề mặt dịu nhẹ tự nhiên có nguồn gốc từ dừa: giúp làm sạch sâu da mà không gây khô căng hay kích ứng, phù hợp cho cả những làn da nhạy cảm mỏng manh nhất. 


Thành phần đầy đủ:
Water, Sodium Cocoyl isethionate, Glycerin, Sodium Methyl Cocoyl Taurate, Coco-Betaine, Potassium Cocoyl Glycinate, Potassium Benzoate, Sodium Chloride, Polyquaterium-67, Potassium Cocoate, Butylene Glycol, Citric Acid, Helianthus Annuus (Sunflower) Seed Oil, Citrus Aurantium Bergamia (Bergamot) Fruit Oil, Propanediol, Pathenol, 1,2-Hexanediol, Disodium EDTA, Dipropylene Glycol, Camellia Sinensis Leaf Extract, Pelargonium Graveolens Flower Oil, Plycyrrhiza Glabra (Licorice) Root Extract, Agrimonia Eupatoria Extract, Chamaecyparis Obtusa Leaf Extract, Sodium Acetate, Yucca Schidigera Root Extract, Rosa Damascena Flower Oil, Sapindus Mukurossi Fruit Extract, Quillaja Saponaria Bark Extract, Perilla Frutescens Leaf Extract, Saponaria Officinalis Extract, Aspalathus Linearis Leaf Extract, Mentha Rutundifolia Leaf Extract, Chamomilla Recutita (Matricaria) Flower Extract, Mentha Piperita (Peppermint) Extract, Jasminum Officinale (Jasmine) Extract, Camellia Sinensis Leaf Extract, Citrus Junos Fruit Extract, Hyalurunic Acid, Ethylhexylglycerin, Hydrolyzed Hyaluronic Acid, Sodium Hyaluronate. ","


Sử dụng 2 lần/ ngày vào buổi sáng và tối.


Làm ướt da mặt và tay.


Cho 1 hạt đậu sữa rửa mặt ra tay và tạo bọt, sau đó massage lên da mặt theo chuyển động hình tròn trong vòng 60s.


Rửa sạch lại với nước ấm, thấm khô da và cân bằng da với Nước Hoa Hồng B.O.M Từ 8 Loại Trà Cho Mọi Loại Da.

 ",Ngày Và Đêm
https://hasaki.vn/san-pham/gel-rua-mat-isis-pharma-giam-nhon-cho-da-mun-va-da-nhay-cam-250ml-5132.html,https://media.hcdn.vn/catalog/product/g/o/google-shopping-gel-rua-mat-isis-pharma-giam-nhon-cho-da-mun-va-da-nhay-cam-250ml_img_385x385_622873_fit_center.jpg,225300004,Gel Rửa Mặt Isis Pharma Giảm Nhờn Mụn Cho Da Nhạy Cảm 250ml,19,11,415.000 ₫,,,,5.0,4,16,3401381717704,Isis Pharma,Pháp,France,Da thường/Mọi loại da,Tất cả,"Da nhạy cảm, kích ứng, mẩn đỏ","
Aqua (Water), Sodium Laureth Sulfate, Peg-90 Glyceryl Isostearate, Glycerin, Cocamidopropyl Betaine, Pentylene Glycol, Sodium Chloride, Propanediol, Sodium Benzoate, Ppg-26-Buteth-26, Chlorphenesin, Laureth-2, Citric Acid, Peg-40 Hydrogenated Castor Oil, Parfum (Fragrance), Tetrasodium Edta, Zinc Pca, Xylitylglucoside, Buteth-3, Anhydroxylitol, Propylene Glycol, Sodium Benzotriazolyl Butylphenol Sulfonate, Xylitol, Alcohol, Butyl Avocadate, Dipropylene Glycol, Tris(Tetramethylhydroxypiperidinol) Citrate, Propolis Extract, Tributyl Citrate, Boswellia Serrata Resin Extract, Ci 42090 (Blue 1), Propyl Gallate ","


Làm ẩm vùng da mặt, lấy 1 ít Sữa rửa mặt Teen Derm Gel Sensitive ra tay, xoa đều trên tay rồi áp lên mặt, massage nhẹ nhàng từ 30-60 giây.


Sau đó rửa sạch và thấm khô da nhẹ nhàng.


Bảo quản:


Nơi khô ráo thoáng mát.


Tránh ánh nắng trực tiếp, nơi có nhiệt độ cao hoặc ẩm ướt.


Đậy nắp kín sau khi sử dụng.


 ",Ngày Và Đêm
https://hasaki.vn/san-pham/sua-rua-mat-hazeline-chiet-xuat-nghe-hoa-cuc-100g-100915.html,https://media.hcdn.vn/catalog/product/f/a/facebook-dynamic-422207401-1689235503_img_385x385_622873_fit_center.jpg,422207401,Sữa Rửa Mặt Hazeline Giảm Mụn Chiết Xuất Nghệ Hoa Cúc 100g,19,97,46.000 ₫,54.500 ₫,8.500 ₫,-16%,5.0,9,13,8934868166573,Hazeline,Mỹ,Vietnam,Da thường/Mọi loại da,Nữ,Da mụn,"
Nội dung đang được cập nhật ","


Làm ướt mặt, cho một ít sữa rửa mặt ra lòng bàn tay.


Thoa và massage đều mặt.


Rửa lại bằng nước sạch.

 ",Ngày Và Đêm
https://hasaki.vn/san-pham/gel-rua-mat-bioderma-lam-sach-sau-va-giam-mun-200ml-120840.html,https://media.hcdn.vn/catalog/product/f/a/facebook-dynamic-gel-rua-mat-bioderma-lam-sach-sau-va-giam-mun-200ml-1712049339_img_385x385_622873_fit_center.jpg,422219315,Gel Rửa Mặt Bioderma Làm Sạch Sâu Và Giảm Mụn 200ml,19,16,284.000 ₫,365.000 ₫,81.000 ₫,-22%,0.0,0,1,3701129803400,Bioderma,Pháp,,Da thường/Mọi loại da,Tất cả,Da mụn,"

Thành phần chính:


Bộ đôi 1,8% BHA (Salicylic Acid) và 1% AHA (Glycolic acid): làm sạch bụi bẩn và bã nhờn, nhẹ nhàng loại bỏ da chết, giúp thông thoáng lỗ chân lông


Zinc gluconate 3%: điều hòa tuyến bã nhờn.


Caprylyl/capryl glucoside: làm sạch nhẹ đồng thời tôn trọng sự cân bằng của da.


Thành phần chi tiết:
Aqua/Water/Eau, Caprylyl/Capryl Glucoside, Propanediol, Glycerin, Zinc Gluconate, Salicylic Acid, Glycolic Acid, Coco-Glucoside, Glyceryl Oleate, Cellulose Gum, Sodium Hydroxide, Citric Acid, Inulin, Xanthan Gum, Mannitol, Sodium Citrate, Xylitol, Cellulose, Fructose, Glucose, Rhamnose, Sodium Metabisulfite, Fructooligosaccharides, Tocopherol, Hydrogenated Palm Glycerides Citrate, Fragrance (Parfum)
 

 ","

BƯỚC 1: Lấy một ít sản phẩm lên tay ướt đã rửa sạch và tạo bọt.
BƯỚC 2: Massage nhẹ nhàng lên vùng da đã làm ướt rồi rửa lại thật sạch.
BƯỚC 3: Lau khô nhẹ nhàng bằng khăn sạch.

 ",
https://hasaki.vn/san-pham/gel-rua-mat-hazeline-ngua-mun-diu-nhe-matcha-tram-tra-100g-100913.html,https://media.hcdn.vn/catalog/product/f/a/facebook-dynamic-422207400-1689235423_img_385x385_622873_fit_center.jpg,422207400,Sữa Rửa Mặt Hazeline Ngừa Mụn Dịu Nhẹ Matcha Tràm Trà 100g,19,89,49.000 ₫,55.500 ₫,6.500 ₫,-12%,5.0,9,13,8934868183181,Hazeline,Mỹ,Vietnam,Da thường/Mọi loại da,Nữ,Da mụn,"
Nội dung đang được cập nhật ","


Làm ướt mặt, cho một ít sữa rửa mặt ra lòng bàn tay.


Thoa và massage đều mặt.


Rửa lại bằng nước sạch.

 ",Ngày Và Đêm
https://hasaki.vn/san-pham/combo-la-roche-posay-kem-duong-giam-mun-hieu-qua-40ml-gel-rua-mat-cho-da-dau-nhay-cam-50ml-121668.html,https://media.hcdn.vn/catalog/product/f/a/facebook-dynamic-combo-la-roche-posay-kem-duong-giam-mun-hieu-qua-40ml-gel-rua-mat-cho-da-dau-nhay-cam-50ml-1713579283_img_385x385_622873_fit_center.jpg,422219812,"Combo La Roche-Posay Kem Dưỡng Giảm Mụn Hiệu Quả 40ml + Gel Rửa Mặt Cho Da Dầu, Nhạy Cảm 50ml",19,11,408.000 ₫,480.000 ₫,72.000 ₫,-15%,0.0,0,0,8935274669955,La Roche-Posay,Pháp,Vietnam,Da thường/Mọi loại da,Tất cả,Da mụn,"
1. Kem Dưỡng Giảm Mụn Hiệu Quả La Roche-Posay Effaclar Duo+ M 40ml
Thành phần chính:


Phylobioma: Loại bỏ lớp sừng, dày, sâu trên da


Niacinamide: Kiểm soát dầu nhờn


Procerad: Giảm thâm sau mụn


Thành phần chi tiết:
Aqua / Water / Eau, Glycerin, Dimethicone, Isocetyl Stearate, Niacinamide, Isopropyl Lauroyl Sarcosinate, Silica, Ammonium Polyacryloyldimethyl Taurate, Oryza Sativa Starch / Rice Starch, Punica Granatum Pericarp Extract, Potassium Cetyl Phosphate, Sorbitan Oleate, Zinc Pca, Glyceryl Stearate Se, Isohexadecane, Sodium Hydroxide, Myristyl Myristate, 2-Oleamido-1,3-Octadecanediol, Mannose, Poloxamer 338, Propanediol, Hydroxyethoxyphenyl  Butanone, Capryloyl Salicylic Acid, Caprylyl Glycol, Vitreoscilla Ferment, Citric Acid, Trisodium Ethylenediamine Disuccinate, Maltodextrin, Xanthan Gum, Pentylene Glycol, Polysorbate 80, Acrylamide / Sodium Acryloyldimethyltaurate Copolymer, Salicylic Acid, Piroctone Olamine, Parfum / Fragrance.
2. Gel Rửa Mặt Cho Da Dầu, Nhạy Cảm La Roche-Posay Effaclar Purifying Foaming Gel For Oily Sensitive Skin 50ml
Thành phần chính: 


Nước khoáng thiên nhiên La Roche-Posay: có tác dụng làm dịu da và giảm kích ứng.


ZinC PCA: giúp điều tiết lượng dầu tiết ra trên da, từ đó kiểm soát bóng dầu và bã nhờn dư thừa hiệu quả, giảm hình thành mụn đầu đen.


Không chứa Paraben, chất tạo màu, xà phòng, cồn, an toàn cho làn da nhạy cảm.


Công thức không chứa dầu (oil-free) nên rất thích hợp cho da dầu.


Thành phần chi tiết: 
Aqua / Water, Sodium Laureth Sulfate, Peg-8, Coco-Betaine, Hexylene Glycol, Sodium Chloride, Peg-120 Methyl Glucose Dioleate, Zinc Pca, Sodium Hydroxide, Citric Acid, Sodium Benzoate, Phenoxyethanol, Caprylyl Glycol, Parfum / Fragrance
 ","
1. Kem Dưỡng Giảm Mụn Hiệu Quả La Roche-Posay Effaclar Duo+ M 40ml


Dùng được cho cả sáng - tối.


Sử dụng sau khi làm sạch da với gel rửa mặt Effaclar Foaming Gel.


Phù hợp làm lớp lót make up.


2. Gel Rửa Mặt Cho Da Dầu, Nhạy Cảm La Roche-Posay Effaclar Purifying Foaming Gel For Oily Sensitive Skin 50ml


Làm ẩm da với nước ấm, cho một lượng vừa đủ sản phẩm ra tay, tạo bọt, thoa sản phẩm lên mặt, tránh vùng da quanh mắt.


Massage nhẹ nhàng, sau đó rửa sạch lại với nước và thấm khô da.


Sử dụng hằng ngày vào buổi sáng và tối.


Lưu ý: 


Tránh tiếp xúc với mắt.


Trong quá trình sử dụng nếu thấy da có các biểu hiện khác thường như: xuất hiện các vết đỏ, ngứa, hay bị kích ứng thì phải ngưng sử dụng ngay và hỏi ý kiến tư vấn từ chuyên gia da liễu.


 ",
https://hasaki.vn/san-pham/combo-2-sua-rua-mat-cetaphil-diu-lanh-cho-da-nhay-cam-250ml-moi-118492.html,https://media.hcdn.vn/catalog/product/p/r/promotions-auto-combo-2-sua-rua-mat-cetaphil-diu-lanh-cho-da-nhay-cam-250ml-moi_f2r2GGGQ6qHnGj8i_img_385x385_622873_fit_center.png,422218633,Combo 2 Sữa Rửa Mặt Cetaphil Dịu Lành Cho Da Nhạy Cảm 250ml (Mới),19,9,455.000 ₫,560.000 ₫,105.000 ₫,-19%,4.5,31,96,,Cetaphil,Canada,Canada,Da nhạy cảm,Tất cả,"Da nhạy cảm, kích ứng, mẩn đỏ","
Thành phần chính:



Glycerin giúp ngăn ngừa hiện tượng khô da.


Niacinamide (B3) giúp củng cố hàng rào bảo vệ da.


Panthenol (B5) giúp làm dịu và phục hồi làn da.



Thành phần chi tiết:
Aqua, Glycerin, Cetearyl Alcohol, Panthenol, Niacinamide, Pantolactone, Xanthan Gum, Sodium Cocoyl Isethionate, Sodium Benzoate, Citric Acid. FIL.1747.V00 ","


Hướng dẫn rửa mặt khô: Lấy một lượng vừa đủ sữa rửa mặt thoa lên da và xoa nhẹ nhàng. Làm sạch phần sữa rửa mặt thừa bằng khăn mềm, để lại trên da cảm giác sạch nhẹ nhàng mà vẫn mịn màng.


Hướng dẫn rửa mặt với nước: Thoa đều sữa rửa mặt lên da và massage nhẹ nhàng. Sau đó rửa sạch lại với nước.


CHU TRÌNH CHĂM SÓC DA NHẠY CẢM
1. Rửa mặt, làm sạch da dịu nhẹ vào mỗi buổi sáng và tối
Thích hợp sử dụng cho mọi loại da, kể cả da nhạy cảm, Sữa rửa mặt dịu nhẹ Cetaphil Gentle Skin Cleanser giúp loại bỏ bụi bẩn, lớp trang điểm và các tạp chất một cách hiệu quả, đồng thời vẫn duy trì màng ẩm tự nhiên của da.
2. Khóa ẩm trên da với kem dưỡng ẩm ban ngày
Sau khi rửa mặt, hãy nhanh chóng thoa Kem dưỡng ẩm khi da vẫn còn ẩm để da dễ dàng ngậm nước và có tác dụng khoá ẩm dài lâu.
Vào ban ngày, nên sử dụng Kem dưỡng ẩm có chứa SPF để bảo vệ da mặt dưới ánh nắng. Kem dưỡng ẩm da mặt hàng ngày Daily Facial Moisturizer với SPF 15 vừa mang đến khả năng dưỡng ẩm mịn mượt giúp khoá chặt độ ẩm cần thiết để nuôi dưỡng làn da, vừa giúp bảo vệ da các khỏi tác hại từ tia cực tím UVA và UVB.
3. Sử dụng Kem dưỡng ẩm ban đêm để cấp ẩm, tái tạo & phục hồi cho da
Đừng quên sử dụng Kem dưỡng ẩm ban đêm Cetaphil Moisturizing Cream trước khi đi ngủ nhé. Với thành phần axit hyaluronic có trong sản phẩm sẽ giúp tăng khả năng trữ nước và dưỡng ẩm cho da, bảo vệ da không bị khô suốt đêm cho da luôn trông thật tươi tắn và rạng rỡ vào sáng hôm sau. ",Không Xà Phòng
